,screen_name,username,user_id,tweet_id,tweet_url,timestamp,timestamp_epochs,text,text_html,links,hashtags,has_media,img_urls,video_url,likes,retweets,replies,is_replied,is_reply_to,parent_tweet_id,reply_to_users
131,jbertranroig,Jordi Bertran,98583674,1142441674653798402,/jbertranroig/status/1142441674653798402,2019-06-22 14:38:15,1561214295,La @MariamMecky explicava aquesta setmana a Barcelona la regressió en matèria de drets de les dones i la seva desprotecció envers la violència que pateixen al #medyouthforum2019 i #euromesco2019 organitzats per l’ @IEMed_ @joanrourav hi era per parlar-hi https://twitter.com/joanrourav/status/1142437365635530753 …,"<p class=""TweetTextSize js-tweet-text tweet-text"" data-aria-label-part=""4"" lang=""ca"">La <a class=""twitter-atreply pretty-link js-nav"" data-mentioned-user-id=""247765292"" dir=""ltr"" href=""/MariamMecky""><s>@</s><b>MariamMecky</b></a> explicava aquesta setmana a <strong>Barcelona</strong> la regressió en matèria de drets de les dones i la seva desprotecció envers la <strong>violència</strong> que pateixen al <a class=""twitter-hashtag pretty-link js-nav"" data-query-source=""hashtag_click"" dir=""ltr"" href=""/hashtag/medyouthforum2019?src=hash""><s>#</s><b>medyouthforum2019</b></a> i <a class=""twitter-hashtag pretty-link js-nav"" data-query-source=""hashtag_click"" dir=""ltr"" href=""/hashtag/euromesco2019?src=hash""><s>#</s><b>euromesco2019</b></a> organitzats per l’ <a class=""twitter-atreply pretty-link js-nav"" data-mentioned-user-id=""304435432"" dir=""ltr"" href=""/IEMed_""><s>@</s><b>IEMed_</b></a> <a class=""twitter-atreply pretty-link js-nav"" data-mentioned-user-id=""1216137966"" dir=""ltr"" href=""/joanrourav""><s>@</s><b>joanrourav</b></a> hi era per parlar-hi <img alt=""👏"" aria-label=""Emoji: Signo de manos aplaudiendo"" class=""Emoji Emoji--forText"" draggable=""false"" src=""https://abs.twimg.com/emoji/v2/72x72/1f44f.png"" title=""Signo de manos aplaudiendo""/><a class=""twitter-timeline-link u-hidden"" data-expanded-url=""https://twitter.com/joanrourav/status/1142437365635530753"" dir=""ltr"" href=""https://t.co/9x67MzKebE"" rel=""nofollow noopener"" target=""_blank"" title=""https://twitter.com/joanrourav/status/1142437365635530753""><span class=""tco-ellipsis""></span><span class=""invisible"">https://</span><span class=""js-display-url"">twitter.com/joanrourav/sta</span><span class=""invisible"">tus/1142437365635530753</span><span class=""tco-ellipsis""><span class=""invisible""> </span>…</span></a></p>",['https://twitter.com/joanrourav/status/1142437365635530753'],"['medyouthforum2019', 'euromesco2019']",False,[],,2,0,0,False,False,,[]
132,JDesviat,JDesviat🎗🎗,920189631865458688,1142433754247512064,/JDesviat/status/1142433754247512064,2019-06-22 14:06:47,1561212407,"Ya dais por sentado la agresión, esta todo preparado por vuestra parte VOX??? 
Cuando se acabe la investigación de los hechos entonces me contestas. Espero que pidáis perdón si se declara que no hubo agresión. Pero nada seguir con vuestra campaña de Catalanofobia.","<p class=""TweetTextSize js-tweet-text tweet-text"" data-aria-label-part=""0"" lang=""es"">Ya dais por sentado la <strong>agresión</strong>, esta todo preparado por vuestra parte VOX??? 
Cuando se acabe la investigación de los hechos entonces me contestas. Espero que pidáis perdón si se declara que no hubo <strong>agresión</strong>. Pero nada seguir con vuestra campaña de Catalanofobia.</p>",[],[],False,[],,0,0,1,True,True,1141804715677814786,"[{'screen_name': 'JDesviat', 'user_id': '920189631865458688'}, {'screen_name': 'vox_barcelona', 'user_id': '2375743544'}]"
133,GUERRRO58,JUAN RAMON GUERRERO,584837649,1142433472897851393,/GUERRRO58/status/1142433472897851393,2019-06-22 14:05:39,1561212339,"Se puede votar esto en Barcelona, o es delito?","<p class=""TweetTextSize js-tweet-text tweet-text"" data-aria-label-part=""0"" lang=""es"">Se puede votar esto en <strong>Barcelona</strong>, o es <strong>delito</strong>?</p>",[],[],False,[],,2,0,1,True,True,1142429837921083393,"[{'screen_name': 'republicanoespa', 'user_id': '1220008340'}]"
134,GUERRRO58,JUAN RAMON GUERRERO,584837649,1142432928821104640,/GUERRRO58/status/1142432928821104640,2019-06-22 14:03:30,1561212210,"Y esto no es delito?, porque en Barcelona por una cosa así, nos molieron a palos","<p class=""TweetTextSize js-tweet-text tweet-text"" data-aria-label-part=""0"" lang=""es"">Y esto no es <strong>delito</strong>?, porque en <strong>Barcelona</strong> por una cosa así, nos molieron a palos</p>",[],[],False,[],,0,0,1,True,True,1142398786955829248,"[{'screen_name': 'Coordinadora25S', 'user_id': '780717692'}]"
135,tyronalberto,tyron alberto,506044145,1142430285893705728,/tyronalberto/status/1142430285893705728,2019-06-22 13:53:00,1561211580,Quien insita a la violencia es ud sr zambrano con sus comentarios si le ardio que Barcelona gane el clásico ni lo demuestre tanto,"<p class=""TweetTextSize js-tweet-text tweet-text"" data-aria-label-part=""0"" lang=""es"">Quien insita a la <strong>violencia</strong> es ud sr zambrano con sus comentarios si le ardio que <strong>Barcelona</strong> gane el clásico ni lo demuestre tanto</p>",[],[],False,[],,1,0,0,False,True,1142423991875002368,"[{'screen_name': 'kzambra', 'user_id': '317858032'}]"
136,CNT_Villaverde,CNT Comarcal Sur Madrid,403085556,1142428553583169538,/CNT_Villaverde/status/1142428553583169538,2019-06-22 13:46:07,1561211167,"La policía municipal hacia, aquí o en Barcelona, lo mismo pero ahora soltarán más a los perros.
De aquellos barros, estos lodos.
Sobrevivir es delito. https://twitter.com/IUMadridCiudad/status/1141763670688616448 …","<p class=""TweetTextSize js-tweet-text tweet-text"" data-aria-label-part=""4"" lang=""es"">La policía municipal hacia, aquí o en <strong>Barcelona</strong>, lo mismo pero ahora soltarán más a los perros.
De aquellos barros, estos lodos.
Sobrevivir es <strong>delito</strong>. <a class=""twitter-timeline-link u-hidden"" data-expanded-url=""https://twitter.com/IUMadridCiudad/status/1141763670688616448"" dir=""ltr"" href=""https://t.co/EH6lmec7m2"" rel=""nofollow noopener"" target=""_blank"" title=""https://twitter.com/IUMadridCiudad/status/1141763670688616448""><span class=""tco-ellipsis""></span><span class=""invisible"">https://</span><span class=""js-display-url"">twitter.com/IUMadridCiudad</span><span class=""invisible"">/status/1141763670688616448</span><span class=""tco-ellipsis""><span class=""invisible""> </span>…</span></a></p>",['https://twitter.com/IUMadridCiudad/status/1141763670688616448'],[],False,[],,4,5,0,False,False,,[]
137,Cristia65095045,Fergu86,1018886925221072896,1142428096567685121,/Cristia65095045/status/1142428096567685121,2019-06-22 13:44:18,1561211058,"si están sentados en sus casas y cuando se levanten no moverán un dedo por su población... mientras siga la ceguera de sus votantes a sufrir que toca.
cuando todo estalle con violencia lloraremos.","<p class=""TweetTextSize js-tweet-text tweet-text"" data-aria-label-part=""0"" lang=""es"">si están sentados en sus casas y cuando se levanten no moverán un dedo por su población... mientras siga la ceguera de sus votantes a sufrir que toca.
cuando todo estalle con <strong>violencia</strong> lloraremos.</p>",[],[],False,[],,3,0,0,False,True,1142223066879184896,"[{'screen_name': 'carmeloblazquez', 'user_id': '71118594'}, {'screen_name': 'BCNHelpers', 'user_id': '1127632947912351746'}]"
138,byron_pinto10,Byron Pinto Rodríguez🇪🇨🇦🇷🇪🇸,3354353021,1142424736024158214,/byron_pinto10/status/1142424736024158214,2019-06-22 13:30:56,1561210256,Si Ramos busca violencia Recalvo fue igual porque desprestigio la victoria de barcelona el dia miercoles disque periodista y se nota q eres hincha azul porque no hablas de la expulsión y las señas q hizo tu jugador de tu equipo periodista mediocre,"<p class=""TweetTextSize js-tweet-text tweet-text"" data-aria-label-part=""0"" lang=""es"">Si Ramos busca <strong>violencia</strong> Recalvo fue igual porque desprestigio la victoria de <strong>barcelona</strong> el dia miercoles disque periodista y se nota q eres hincha azul porque no hablas de la expulsión y las señas q hizo tu jugador de tu equipo periodista mediocre</p>",[],[],False,[],,0,1,0,False,True,1142423991875002368,"[{'screen_name': 'kzambra', 'user_id': '317858032'}]"
139,La_SER,Cadena SER,43910684,1142413174072860672,/La_SER/status/1142413174072860672,2019-06-22 12:45:00,1561207500,"Seis meses de cárcel por una agresión racista en Barcelona: ""¡China de mierda!"" https://cadenaser.com/ser/2019/06/22/tribunales/1561201860_666728.html … Informa @albert_poux","<p class=""TweetTextSize js-tweet-text tweet-text"" data-aria-label-part=""0"" lang=""es"">Seis meses de cárcel por una <strong>agresión</strong> racista en <strong>Barcelona</strong>: ""¡China de mierda!"" <a class=""twitter-timeline-link"" data-expanded-url=""https://cadenaser.com/ser/2019/06/22/tribunales/1561201860_666728.html"" dir=""ltr"" href=""https://t.co/ZzLfKRX1Me"" rel=""nofollow noopener"" target=""_blank"" title=""https://cadenaser.com/ser/2019/06/22/tribunales/1561201860_666728.html""><span class=""tco-ellipsis""></span><span class=""invisible"">https://</span><span class=""js-display-url"">cadenaser.com/ser/2019/06/22</span><span class=""invisible"">/tribunales/1561201860_666728.html</span><span class=""tco-ellipsis""><span class=""invisible""> </span>…</span></a> Informa <a class=""twitter-atreply pretty-link js-nav"" data-mentioned-user-id=""285723719"" dir=""ltr"" href=""/albert_poux""><s>@</s><b>albert_poux</b></a></p>",['https://cadenaser.com/ser/2019/06/22/tribunales/1561201860_666728.html'],[],False,[],,9,6,1,True,False,,[]
140,jordipsalvador,Jordi Peña Salvador,299780796,1142408408529801216,/jordipsalvador/status/1142408408529801216,2019-06-22 12:26:04,1561206364,"Seis meses de cárcel por una agresión racista en Barcelona: ""¡China de mierda!"" https://cadenaser.com/ser/2019/06/22/tribunales/1561201860_666728.html#?ref=rss&format=simple&link=link …","<p class=""TweetTextSize js-tweet-text tweet-text"" data-aria-label-part=""0"" lang=""es"">Seis meses de cárcel por una <strong>agresión</strong> racista en <strong>Barcelona</strong>: ""¡China de mierda!"" <a class=""twitter-timeline-link"" data-expanded-url=""https://cadenaser.com/ser/2019/06/22/tribunales/1561201860_666728.html#?ref=rss&amp;format=simple&amp;link=link"" dir=""ltr"" href=""https://t.co/2qUV5qo2eY"" rel=""nofollow noopener"" target=""_blank"" title=""https://cadenaser.com/ser/2019/06/22/tribunales/1561201860_666728.html#?ref=rss&amp;format=simple&amp;link=link""><span class=""tco-ellipsis""></span><span class=""invisible"">https://</span><span class=""js-display-url"">cadenaser.com/ser/2019/06/22</span><span class=""invisible"">/tribunales/1561201860_666728.html#?ref=rss&amp;format=simple&amp;link=link</span><span class=""tco-ellipsis""><span class=""invisible""> </span>…</span></a></p>",['https://cadenaser.com/ser/2019/06/22/tribunales/1561201860_666728.html#?ref=rss&format=simple&link=link'],[],False,[],,0,0,0,False,False,,[]
141,ardesangres,Anibal Barca,636307045,1142404683245506560,/ardesangres/status/1142404683245506560,2019-06-22 12:11:15,1561205475,"- La Generalidad y su presidente defienden la violencia, la tensión y la persecución de los patriotas en España de forma pública.
- Los medios catalanes tergiversarán los hechos denunciados con su opinión.
- Por las redes sociales los siervos de la independencia lo negarán.
Y etc","<p class=""TweetTextSize js-tweet-text tweet-text"" data-aria-label-part=""0"" lang=""es"">- La Generalidad y su presidente defienden la <strong>violencia</strong>, la tensión y la persecución de los patriotas en España de forma pública.
- Los medios catalanes tergiversarán los hechos denunciados con su opinión.
- Por las redes sociales los siervos de la independencia lo negarán.
Y etc</p>",[],[],False,[],,0,0,0,False,True,1142115481253494784,"[{'screen_name': 'ardesangres', 'user_id': '636307045'}, {'screen_name': 'segador78', 'user_id': '915823458562576384'}]"
142,_Saeta_,Siete estrellas,987632139901513728,1142389359880151042,/_Saeta_/status/1142389359880151042,2019-06-22 11:10:22,1561201822,"Y es que es una forma de verlo completamente lógica y que hasta comparto. Pero no sé, no me parece ningún crimen, siendo el fútbol de hoy en día como es, simplemente llegar a un acuerdo con otro club para que se incorporen. Creo que el Barcelona también lo hizo en su momento.","<p class=""TweetTextSize js-tweet-text tweet-text"" data-aria-label-part=""0"" lang=""es"">Y es que es una forma de verlo completamente lógica y que hasta comparto. Pero no sé, no me parece ningún <strong>crimen</strong>, siendo el fútbol de hoy en día como es, simplemente llegar a un acuerdo con otro club para que se incorporen. Creo que el <strong>Barcelona</strong> también lo hizo en su momento.</p>",[],[],False,[],,0,0,0,False,True,1142354922228322306,"[{'screen_name': 'angel_vicente86', 'user_id': '396928004'}, {'screen_name': 'AlvaroBM21', 'user_id': '120507187'}]"
143,e24diari,e24diari,841571722444824576,1142383015752019968,/e24diari/status/1142383015752019968,2019-06-22 10:45:10,1561200310,Juez decreta el ingreso en prisión provisional de la expareja de Mònica Borràs por su crimen en Terrassa (Barcelona) http://www.e24diari.es/texto-diario/mostrar/1461643/prision-expareja-mnica-borrs-asesinato-terrassa …,"<p class=""TweetTextSize js-tweet-text tweet-text"" data-aria-label-part=""0"" lang=""ca"">Juez decreta el ingreso en prisión provisional de la expareja de Mònica Borràs por su <strong>crimen</strong> en Terrassa (<strong>Barcelona</strong>) <a class=""twitter-timeline-link u-hidden"" data-expanded-url=""http://www.e24diari.es/texto-diario/mostrar/1461643/prision-expareja-mnica-borrs-asesinato-terrassa"" dir=""ltr"" href=""https://t.co/GFPUEYjfJ9"" rel=""nofollow noopener"" target=""_blank"" title=""http://www.e24diari.es/texto-diario/mostrar/1461643/prision-expareja-mnica-borrs-asesinato-terrassa""><span class=""tco-ellipsis""></span><span class=""invisible"">http://www.</span><span class=""js-display-url"">e24diari.es/texto-diario/m</span><span class=""invisible"">ostrar/1461643/prision-expareja-mnica-borrs-asesinato-terrassa</span><span class=""tco-ellipsis""><span class=""invisible""> </span>…</span></a></p>",['http://www.e24diari.es/texto-diario/mostrar/1461643/prision-expareja-mnica-borrs-asesinato-terrassa'],[],False,[],,0,1,0,False,False,,[]
144,fernandovilabla,Fernando,236524587,1142379339360718849,/fernandovilabla/status/1142379339360718849,2019-06-22 10:30:33,1561199433,Supongo que la fiscalía de Barcelona no aprecia el cristalino delito de amenazas.,"<p class=""TweetTextSize js-tweet-text tweet-text"" data-aria-label-part=""0"" lang=""es"">Supongo que la fiscalía de <strong>Barcelona</strong> no aprecia el cristalino <strong>delito</strong> de amenazas.</p>",[],[],False,[],,0,0,0,False,True,1142348754642755584,"[{'screen_name': 'eduardoinda', 'user_id': '698104968105095170'}]"
145,oProscritoXan,O Proscrito 2.0📌⛏,481557437,1142361964833886208,/oProscritoXan/status/1142361964833886208,2019-06-22 09:21:31,1561195291,"SI EN NINGUN MOMENTO SE REBELO Y FUE ACUSADO DE FELONIA NI DE NINGUN OTRO DELITO PARECIDO Y MANTUVO SU TITULO Y SU FEUDO... ¿Como puedes afirmar sin ruborizarte que el CONDADO DE BARCELONA ERA INDEPENDIENTE? Sencillamente no puedes, nos cuentas fantasias humedas de alguien","<p class=""TweetTextSize js-tweet-text tweet-text"" data-aria-label-part=""0"" lang=""es"">SI EN NINGUN MOMENTO SE REBELO Y FUE ACUSADO DE FELONIA NI DE NINGUN OTRO <strong>DELITO</strong> PARECIDO Y MANTUVO SU TITULO Y SU FEUDO... ¿Como puedes afirmar sin ruborizarte que el CONDADO DE <strong>BARCELONA</strong> ERA INDEPENDIENTE? Sencillamente no puedes, nos cuentas fantasias humedas de alguien</p>",[],[],False,[],,0,0,0,False,True,1007372492351123460,"[{'screen_name': 'RAGAFO1', 'user_id': '377506071'}, {'screen_name': 'CODEXREVISUS', 'user_id': '870388458'}]"
146,segador78,Segador 🎗,915823458562576384,1142359440911474688,/segador78/status/1142359440911474688,2019-06-22 09:11:29,1561194689,Lo unico demostrado es que a la multitudinària concentracions del colegio fueron 31 personas y tambien que es una invencion de agresion. Ningún otro niño vio nada. Y se rechazaron TODOS los dibujos con Banderas y simbolos. FALSOS,"<p class=""TweetTextSize js-tweet-text tweet-text"" data-aria-label-part=""0"" lang=""es"">Lo unico demostrado es que a la multitudinària concentracions del colegio fueron 31 personas y tambien que es una invencion de <strong>agresion</strong>. Ningún otro niño vio nada. Y se rechazaron TODOS los dibujos con Banderas y simbolos. FALSOS</p>",[],[],False,[],,0,0,2,True,True,1142115481253494784,"[{'screen_name': 'vox_barcelona', 'user_id': '2375743544'}, {'screen_name': 'Vox_ElPrat', 'user_id': '1082575031182471170'}]"
147,RavalSud,Raval Sud,776269374801973248,1142334119529066496,/RavalSud/status/1142334119529066496,2019-06-22 07:30:52,1561188652,Brutal agresión a trabajadores del metro de Barcelona https://www.metropoliabierta.com/el-pulso-de-la-ciudad/sucesos/brutal-agresion-trabajadores-metro-plaza-catalunya_17644_102.html …,"<p class=""TweetTextSize js-tweet-text tweet-text"" data-aria-label-part=""0"" lang=""es"">Brutal <strong>agresión</strong> a trabajadores del metro de <strong>Barcelona</strong> <a class=""twitter-timeline-link u-hidden"" data-expanded-url=""https://www.metropoliabierta.com/el-pulso-de-la-ciudad/sucesos/brutal-agresion-trabajadores-metro-plaza-catalunya_17644_102.html"" dir=""ltr"" href=""https://t.co/1IJvd1CmZB"" rel=""nofollow noopener"" target=""_blank"" title=""https://www.metropoliabierta.com/el-pulso-de-la-ciudad/sucesos/brutal-agresion-trabajadores-metro-plaza-catalunya_17644_102.html""><span class=""tco-ellipsis""></span><span class=""invisible"">https://www.</span><span class=""js-display-url"">metropoliabierta.com/el-pulso-de-la</span><span class=""invisible"">-ciudad/sucesos/brutal-agresion-trabajadores-metro-plaza-catalunya_17644_102.html</span><span class=""tco-ellipsis""><span class=""invisible""> </span>…</span></a></p>",['https://www.metropoliabierta.com/el-pulso-de-la-ciudad/sucesos/brutal-agresion-trabajadores-metro-plaza-catalunya_17644_102.html'],[],False,[],,0,1,0,False,False,,[]
148,FiodoirMacTire,Fíodoir Lucky Mac Tíre,958688699730092033,1142325045999652864,/FiodoirMacTire/status/1142325045999652864,2019-06-22 06:54:48,1561186488,"Mucho estamos tardando los que vivimos en el centro de Barcelona y usamos twitter en organizar una manifestación en contra de la inestabilidad que viven barrios como El Raval o El Born. Cada día más inseguridad, más delincuencia y más droga.  
¿Para cuando una manifestación?","<p class=""TweetTextSize js-tweet-text tweet-text"" data-aria-label-part=""0"" lang=""es"">Mucho estamos tardando los que vivimos en el centro de <strong>Barcelona</strong> y usamos twitter en organizar una manifestación en contra de la inestabilidad que viven barrios como El Raval o El Born. Cada día más <strong>inseguridad</strong>, más <strong>delincuencia</strong> y más droga.  
¿Para cuando una manifestación?</p>",[],[],False,[],,171,69,15,True,False,,[]
149,Andaya2604,Andayá,905538018538336257,1142290081920815105,/Andaya2604/status/1142290081920815105,2019-06-22 04:35:52,1561178152,"Como ellos abajo, en su propio artículo, dicen ""Se trata de un organismo adscrito a la Universidad de Barcelona"".
Sí, ese lugar donde si no eres independentista sufres el escarnio, acoso y la agresión permanentemente.
No hay más preguntas, Señoría. https://twitter.com/elnacionalcat/status/1142284827925909510 …","<p class=""TweetTextSize js-tweet-text tweet-text"" data-aria-label-part=""4"" lang=""es"">Como ellos abajo, en su propio artículo, dicen ""Se trata de un organismo adscrito a la Universidad de <strong>Barcelona</strong>"".
Sí, ese lugar donde si no eres independentista sufres el escarnio, acoso y la <strong>agresión</strong> permanentemente.
No hay más preguntas, Señoría. <a class=""twitter-timeline-link u-hidden"" data-expanded-url=""https://twitter.com/elnacionalcat/status/1142284827925909510"" dir=""ltr"" href=""https://t.co/PhP4OIF0OJ"" rel=""nofollow noopener"" target=""_blank"" title=""https://twitter.com/elnacionalcat/status/1142284827925909510""><span class=""tco-ellipsis""></span><span class=""invisible"">https://</span><span class=""js-display-url"">twitter.com/elnacionalcat/</span><span class=""invisible"">status/1142284827925909510</span><span class=""tco-ellipsis""><span class=""invisible""> </span>…</span></a></p>",['https://twitter.com/elnacionalcat/status/1142284827925909510'],[],False,[],,6,3,0,False,False,,[]
150,CambioHome,Tiempos Del Cambio,958615230405316608,1142284656273973249,/CambioHome/status/1142284656273973249,2019-06-22 04:14:19,1561176859,"Però aquests que han agafat són gent de perfil molt baix. 
Per quant una redada al port de Barcelona de conetidors amb tones de droga? ,
o el tancament de laboratoris clandestins?, 
I detenció de les organitzacions internacional de màfies del crim organitzat?","<p class=""TweetTextSize js-tweet-text tweet-text"" data-aria-label-part=""0"" lang=""ca"">Però aquests que han agafat són gent de perfil molt baix. <img alt=""🤔"" aria-label=""Emoji: Rostro pensativo"" class=""Emoji Emoji--forText"" draggable=""false"" src=""https://abs.twimg.com/emoji/v2/72x72/1f914.png"" title=""Rostro pensativo""/>
<img alt=""👂"" aria-label=""Emoji: Oreja"" class=""Emoji Emoji--forText"" draggable=""false"" src=""https://abs.twimg.com/emoji/v2/72x72/1f442.png"" title=""Oreja""/><img alt=""👁️"" aria-label=""Emoji: Ojo"" class=""Emoji Emoji--forText"" draggable=""false"" src=""https://abs.twimg.com/emoji/v2/72x72/1f441.png"" title=""Ojo""/>Per quant una redada al port de <strong>Barcelona</strong> de conetidors amb tones de droga? ,
<img alt=""👂"" aria-label=""Emoji: Oreja"" class=""Emoji Emoji--forText"" draggable=""false"" src=""https://abs.twimg.com/emoji/v2/72x72/1f442.png"" title=""Oreja""/><img alt=""👁️"" aria-label=""Emoji: Ojo"" class=""Emoji Emoji--forText"" draggable=""false"" src=""https://abs.twimg.com/emoji/v2/72x72/1f441.png"" title=""Ojo""/>o el tancament de laboratoris clandestins?, 
<img alt=""👂"" aria-label=""Emoji: Oreja"" class=""Emoji Emoji--forText"" draggable=""false"" src=""https://abs.twimg.com/emoji/v2/72x72/1f442.png"" title=""Oreja""/><img alt=""👁️"" aria-label=""Emoji: Ojo"" class=""Emoji Emoji--forText"" draggable=""false"" src=""https://abs.twimg.com/emoji/v2/72x72/1f441.png"" title=""Ojo""/>I detenció de les organitzacions internacional de màfies del <strong>crim</strong> organitzat?</p>",[],[],False,[],,0,0,0,False,True,1141985160700813312,"[{'screen_name': 'SOSRacis', 'user_id': '197418443'}, {'screen_name': 'AdaColau', 'user_id': '102095809'}]"
151,Ismvele,Jaime,760286733233684480,1142242122030100482,/Ismvele/status/1142242122030100482,2019-06-22 01:25:18,1561166718,Porque no dijiste nada de lo que dijo Rescalvo? Dices que Ramos incita a la violencia das Rt a tuits de hinchas insultando a Barcelona ten algo de coherencia se sabe que por la edad y el poco razonamiento que siempre has tenido eso es difícil para ti pero has el intento al menos,"<p class=""TweetTextSize js-tweet-text tweet-text"" data-aria-label-part=""0"" lang=""es"">Porque no dijiste nada de lo que dijo Rescalvo? Dices que Ramos incita a la <strong>violencia</strong> das Rt a tuits de hinchas insultando a <strong>Barcelona</strong> ten algo de coherencia se sabe que por la edad y el poco razonamiento que siempre has tenido eso es difícil para ti pero has el intento al menos</p>",[],[],False,[],,0,1,0,False,True,1142235375957630976,"[{'screen_name': 'kzambra', 'user_id': '317858032'}]"
152,Baqvel,Cristhian,76374867,1142239189708288002,/Baqvel/status/1142239189708288002,2019-06-22 01:13:39,1561166019,"En serio que ya la vejez le está pegando a este enano hp @Kzambra si Ramos incita a la violencia ayer Rescalvo que hizo al decir que prefiere perder jugando así a ganar como lo hizo Barcelona, Ramos solo responde y entre líneas dice que deberían preocuparse ellos mismos de ganar pic.twitter.com/nPhNkjOlSe","<p class=""TweetTextSize js-tweet-text tweet-text"" data-aria-label-part=""0"" lang=""es"">En serio que ya la vejez le está pegando a este enano hp <a class=""twitter-atreply pretty-link js-nav"" data-mentioned-user-id=""317858032"" dir=""ltr"" href=""/kzambra""><s>@</s><b>Kzambra</b></a> si Ramos incita a la <strong>violencia</strong> ayer Rescalvo que hizo al decir que prefiere perder jugando así a ganar como lo hizo <strong>Barcelona</strong>, Ramos solo responde y entre líneas dice que deberían preocuparse ellos mismos de ganar <a class=""twitter-timeline-link u-hidden"" data-pre-embedded=""true"" dir=""ltr"" href=""https://t.co/nPhNkjOlSe"">pic.twitter.com/nPhNkjOlSe</a></p>",[],[],True,['https://pbs.twimg.com/media/D9oMe96WsAEi0Re.jpg'],,1,0,0,False,False,,[]
