,screen_name,username,user_id,tweet_id,tweet_url,timestamp,timestamp_epochs,text,text_html,links,hashtags,has_media,img_urls,video_url,likes,retweets,replies,is_replied,is_reply_to,parent_tweet_id,reply_to_users
111,noemicasaslopez,Noe Casetes🌼,2592073415,940952323026767872,/noemicasaslopez/status/940952323026767872,2017-12-13 14:31:30,1513175490,La gracia del Govierno Español viniendo en Barcelona por el atentado de agosto en las ramblas contra la violencia cuando va él y la promueve esta en supuestas formaciones a proteger todo ciudadano con un tanque y amenazando ¿la humanidad dónde?. @PPopular,"<p class=""TweetTextSize js-tweet-text tweet-text"" data-aria-label-part=""0"" lang=""es"">La gracia del Govierno Español viniendo en <strong>Barcelona</strong> por el atentado de agosto en las ramblas contra la <strong>violencia</strong> cuando va él y la promueve esta en supuestas formaciones a proteger todo ciudadano con un tanque y amenazando ¿la humanidad dónde?. <a class=""twitter-atreply pretty-link js-nav"" data-mentioned-user-id=""1100424245132300288"" dir=""ltr"" href=""/PPopular""><s>@</s><b>PPopular</b></a></p>",[],[],False,[],,0,0,0,False,False,,[]
112,BCNmetropoli,Metrópoli Abierta,816600493044670465,940950192534278145,/BCNmetropoli/status/940950192534278145,2017-12-13 14:23:02,1513174982,Vídeo de la agresión de unos grafiteros a unos vigilantes del metro de Barcelona http://ow.ly/hzbO30hcr0N ,"<p class=""TweetTextSize js-tweet-text tweet-text"" data-aria-label-part=""0"" lang=""es"">Vídeo de la <strong>agresión</strong> de unos grafiteros a unos vigilantes del metro de <strong>Barcelona</strong> <a class=""twitter-timeline-link"" data-expanded-url=""http://ow.ly/hzbO30hcr0N"" dir=""ltr"" href=""https://t.co/TrC1DZNlSh"" rel=""nofollow noopener"" target=""_blank"" title=""http://ow.ly/hzbO30hcr0N""><span class=""tco-ellipsis""></span><span class=""invisible"">http://</span><span class=""js-display-url"">ow.ly/hzbO30hcr0N</span><span class=""invisible""></span><span class=""tco-ellipsis""><span class=""invisible""> </span></span></a></p>",['http://ow.ly/hzbO30hcr0N'],[],False,[],,0,0,0,False,False,,[]
113,AjuntamentSVH,Ajuntament SVH,231362747,940936540871692288,/AjuntamentSVH/status/940936540871692288,2017-12-13 13:28:47,1513171727,"L'Ajuntament condemna l'assassinat d'una dona per violència masclista al Raval, Barcelona http://ow.ly/c9qS30hcmjZ pic.twitter.com/uEfwlSFrhF","<p class=""TweetTextSize js-tweet-text tweet-text"" data-aria-label-part=""0"" lang=""ca"">L'Ajuntament condemna l'assassinat d'una dona per <strong>violència</strong> masclista al Raval, <strong>Barcelona</strong> <a class=""twitter-timeline-link"" data-expanded-url=""http://ow.ly/c9qS30hcmjZ"" dir=""ltr"" href=""https://t.co/IERyz7usNt"" rel=""nofollow noopener"" target=""_blank"" title=""http://ow.ly/c9qS30hcmjZ""><span class=""tco-ellipsis""></span><span class=""invisible"">http://</span><span class=""js-display-url"">ow.ly/c9qS30hcmjZ</span><span class=""invisible""></span><span class=""tco-ellipsis""><span class=""invisible""> </span></span></a><a class=""twitter-timeline-link u-hidden"" data-pre-embedded=""true"" dir=""ltr"" href=""https://t.co/uEfwlSFrhF"">pic.twitter.com/uEfwlSFrhF</a></p>",['http://ow.ly/c9qS30hcmjZ'],[],True,['https://pbs.twimg.com/media/DQ7gw6lWsAA-wdz.jpg'],,4,2,0,False,False,,[]
114,PacoSantos1978,Francisco Santos,481066086,940936052512034816,/PacoSantos1978/status/940936052512034816,2017-12-13 13:26:51,1513171611,Hay en el programa una mujer que pide no identificar violencia con okupas y ultraizquierda... que se lo digan a los tenderos y hosteleros de Barcelona cuando hay manifa. Pero que hubiese dicho si el agresor hubiese sido uno de ultraderecha? Hubiese dicho lo mismo esta tía?,"<p class=""TweetTextSize js-tweet-text tweet-text"" data-aria-label-part=""0"" lang=""es"">Hay en el programa una mujer que pide no identificar <strong>violencia</strong> con okupas y ultraizquierda... que se lo digan a los tenderos y hosteleros de <strong>Barcelona</strong> cuando hay manifa. Pero que hubiese dicho si el agresor hubiese sido uno de ultraderecha? Hubiese dicho lo mismo esta tía?</p>",[],[],False,[],,7,1,0,False,True,940930631718064130,"[{'screen_name': 'DebatAlRojoVivo', 'user_id': '237413314'}]"
115,SalvaCarni16,Salva Carnicero 🌐,305618306,940933368920854528,/SalvaCarni16/status/940933368920854528,2017-12-13 13:16:11,1513170971,"Laínez murió tras recibir una paliza por llevar unos tirantes de la bandera de #España

Era miembro de un grupo de moteros y simpatizante de la Falange

El supuesto agresor fue protagonista de #CiutatMorta, documental que cuestionó la agresión al guardia en #Barcelona.

#Zaragozahttps://twitter.com/_infoLibre/status/940886973740404738 …","<p class=""TweetTextSize js-tweet-text tweet-text"" data-aria-label-part=""4"" lang=""es"">Laínez murió tras recibir una paliza por llevar unos tirantes de la bandera de <a class=""twitter-hashtag pretty-link js-nav"" data-query-source=""hashtag_click"" dir=""ltr"" href=""/hashtag/Espa%C3%B1a?src=hash""><s>#</s><b>España</b></a>

Era miembro de un grupo de moteros y simpatizante de la Falange

El supuesto agresor fue protagonista de <a class=""twitter-hashtag pretty-link js-nav"" data-query-source=""hashtag_click"" dir=""ltr"" href=""/hashtag/CiutatMorta?src=hash""><s>#</s><b>CiutatMorta</b></a>, documental que cuestionó la <strong>agresión</strong> al guardia en <a class=""twitter-hashtag pretty-link js-nav"" data-query-source=""hashtag_click"" dir=""ltr"" href=""/hashtag/Barcelona?src=hash""><s>#</s><b><strong>Barcelona</strong></b></a>.

<a class=""twitter-hashtag pretty-link js-nav"" data-query-source=""hashtag_click"" dir=""ltr"" href=""/hashtag/Zaragoza?src=hash""><s>#</s><b>Zaragoza</b></a><a class=""twitter-timeline-link u-hidden"" data-expanded-url=""https://twitter.com/_infoLibre/status/940886973740404738"" dir=""ltr"" href=""https://t.co/lTG2nKQc6V"" rel=""nofollow noopener"" target=""_blank"" title=""https://twitter.com/_infoLibre/status/940886973740404738""><span class=""tco-ellipsis""></span><span class=""invisible"">https://</span><span class=""js-display-url"">twitter.com/_infoLibre/sta</span><span class=""invisible"">tus/940886973740404738</span><span class=""tco-ellipsis""><span class=""invisible""> </span>…</span></a></p>",['https://twitter.com/_infoLibre/status/940886973740404738'],"['España', 'CiutatMorta', 'Barcelona', 'Zaragozahttps']",False,[],,0,0,0,False,False,,[]
116,Gavinablava,Gavina,908311957043912704,940931850469593088,/Gavinablava/status/940931850469593088,2017-12-13 13:10:09,1513170609,"El turisme després de veurà la violència de les porres X anar a votar a deixat de venir a Barcelona es d'allò més normal.
Per culpa vostre PP..i PSOE...per la intervenció de un govern legal i pel segrest de la Autonomia Catalana.","<p class=""TweetTextSize js-tweet-text tweet-text"" data-aria-label-part=""0"" lang=""ca"">El turisme després de veurà la <strong>violència</strong> de les porres X anar a votar a deixat de venir a <strong>Barcelona</strong> es d'allò més normal.
Per culpa vostre PP..i PSOE...per la intervenció de un govern legal i pel segrest de la Autonomia Catalana.</p>",[],[],False,[],,0,1,0,False,True,940930697665089536,"[{'screen_name': 'rac1', 'user_id': '18577646'}]"
117,SanAntn3,San Antón🇪🇸,918014163145908231,940929803762454529,/SanAntn3/status/940929803762454529,2017-12-13 13:02:01,1513170121,"VÍCTOR LAINEZ, primer catalán asesinado víctima del proces por un delito de odio, a manos de un Okupa de extrema izquierda criado en Barcelona. Gracias por esparcer vuestro odio e hispanofobia @JoanTarda. Noticia que se trata de ocultar y los independentistas no condenan.","<p class=""TweetTextSize js-tweet-text tweet-text"" data-aria-label-part=""0"" lang=""es"">VÍCTOR LAINEZ, primer catalán asesinado víctima del proces por un <strong>delito</strong> de odio, a manos de un Okupa de extrema izquierda criado en <strong>Barcelona</strong>. Gracias por esparcer vuestro odio e hispanofobia <a class=""twitter-atreply pretty-link js-nav"" data-mentioned-user-id=""363696047"" dir=""ltr"" href=""/JoanTarda""><s>@</s><b>JoanTarda</b></a>. Noticia que se trata de ocultar y los independentistas no condenan.</p>",[],[],False,[],,5,1,0,False,True,940926637474045952,"[{'screen_name': 'europapress', 'user_id': '121385551'}]"
118,mcyava,Mari Carmen #LaRepublicaNoExisteIdiota🇪🇸,384211578,940929661579792385,/mcyava/status/940929661579792385,2017-12-13 13:01:27,1513170087,"Así dejó tetrapléjico Rodrigo Lanza a un guardia en Barcelona: ""Perro, cabrón, nos lo hemos cargado"" https://www.elindependiente.com/politica/2017/12/13/tetraplejico-rodrigo-lanza-guardia-barcelona/?utm_source=share_buttons&utm_medium=twitter&utm_campaign=social_share … Cuatro añitos de cárcel por ese crimen, viendo lo barato que sale ha querido repetir!! Vergüenza de justicia y de leyes!!","<p class=""TweetTextSize js-tweet-text tweet-text"" data-aria-label-part=""0"" lang=""es"">Así dejó tetrapléjico Rodrigo Lanza a un guardia en <strong>Barcelona</strong>: ""Perro, cabrón, nos lo hemos cargado"" <a class=""twitter-timeline-link"" data-expanded-url=""https://www.elindependiente.com/politica/2017/12/13/tetraplejico-rodrigo-lanza-guardia-barcelona/?utm_source=share_buttons&amp;utm_medium=twitter&amp;utm_campaign=social_share"" dir=""ltr"" href=""https://t.co/bvLj1jBgN6"" rel=""nofollow noopener"" target=""_blank"" title=""https://www.elindependiente.com/politica/2017/12/13/tetraplejico-rodrigo-lanza-guardia-barcelona/?utm_source=share_buttons&amp;utm_medium=twitter&amp;utm_campaign=social_share""><span class=""tco-ellipsis""></span><span class=""invisible"">https://www.</span><span class=""js-display-url"">elindependiente.com/politica/2017/</span><span class=""invisible"">12/13/tetraplejico-rodrigo-lanza-guardia-barcelona/?utm_source=share_buttons&amp;utm_medium=twitter&amp;utm_campaign=social_share</span><span class=""tco-ellipsis""><span class=""invisible""> </span>…</span></a> Cuatro añitos de cárcel por ese <strong>crimen</strong>, viendo lo barato que sale ha querido repetir!! Vergüenza de justicia y de leyes!!</p>",['https://www.elindependiente.com/politica/2017/12/13/tetraplejico-rodrigo-lanza-guardia-barcelona/?utm_source=share_buttons&utm_medium=twitter&utm_campaign=social_share'],[],False,[],,105,143,10,True,False,,[]
119,TMB_Barcelona,TMB,115624105,940929484794089473,/TMB_Barcelona/status/940929484794089473,2017-12-13 13:00:45,1513170045,L'estació de #metrobcn Diagonal s'omple de música contra la violència masclista aquest dijous amb els temes de  @carmendoora http://ow.ly/CM8F30hciaI pic.twitter.com/cbS6ABp7eK,"<p class=""TweetTextSize js-tweet-text tweet-text"" data-aria-label-part=""0"" lang=""ca"">L'estació de <a class=""twitter-hashtag pretty-link js-nav"" data-query-source=""hashtag_click"" dir=""ltr"" href=""/hashtag/metrobcn?src=hash""><s>#</s><b>metrobcn</b></a> Diagonal s'omple de música contra la <strong>violència</strong> masclista aquest dijous amb els temes de  <a class=""twitter-atreply pretty-link js-nav"" data-mentioned-user-id=""550517250"" dir=""ltr"" href=""/carmendoora""><s>@</s><b>carmendoora</b></a> <a class=""twitter-timeline-link"" data-expanded-url=""http://ow.ly/CM8F30hciaI"" dir=""ltr"" href=""https://t.co/sXfZKUWiEm"" rel=""nofollow noopener"" target=""_blank"" title=""http://ow.ly/CM8F30hciaI""><span class=""tco-ellipsis""></span><span class=""invisible"">http://</span><span class=""js-display-url"">ow.ly/CM8F30hciaI</span><span class=""invisible""></span><span class=""tco-ellipsis""><span class=""invisible""> </span></span></a><a class=""twitter-timeline-link u-hidden"" data-pre-embedded=""true"" dir=""ltr"" href=""https://t.co/cbS6ABp7eK"">pic.twitter.com/cbS6ABp7eK</a></p>",['http://ow.ly/CM8F30hciaI'],['metrobcn'],True,['https://pbs.twimg.com/media/DQ7aYOhVwAAKG6n.jpg'],,4,2,0,False,False,,[]
120,Podemos_AND,Podemos Andalucía,3005765446,940929035340800000,/Podemos_AND/status/940929035340800000,2017-12-13 12:58:58,1513169938,"""Ayer mataron a otra mujer en Barcelona, prostituta e inmigrante, en lo que es un caso más de violencia machista que debemos condenar con firmeza"" #EREQueEREM4 @TeresaRodr_pic.twitter.com/wc4w3A42Sd","<p class=""TweetTextSize js-tweet-text tweet-text"" data-aria-label-part=""0"" lang=""es"">""Ayer mataron a otra mujer en <strong>Barcelona</strong>, prostituta e inmigrante, en lo que es un caso más de <strong>violencia</strong> machista que debemos condenar con firmeza"" <a class=""twitter-hashtag pretty-link js-nav"" data-query-source=""hashtag_click"" dir=""ltr"" href=""/hashtag/EREQueEREM4?src=hash""><s>#</s><b>EREQueEREM4</b></a> <a class=""twitter-atreply pretty-link js-nav"" data-mentioned-user-id=""784574954"" dir=""ltr"" href=""/TeresaRodr_""><s>@</s><b>TeresaRodr_</b></a><a class=""twitter-timeline-link u-hidden"" data-pre-embedded=""true"" dir=""ltr"" href=""https://t.co/wc4w3A42Sd"">pic.twitter.com/wc4w3A42Sd</a></p>",[],['EREQueEREM4'],True,['https://pbs.twimg.com/media/DQ7Z9u2XkAAe67p.jpg'],,30,34,7,True,False,,[]
121,e24diari,e24diari,841571722444824576,940926591936483334,/e24diari/status/940926591936483334,2017-12-13 12:49:15,1513169355,Declara otro joven por la paliza mortal al hombre que llevaba tirantes con la bandera de España #Sucesos #Zaragoza #España #RTVE #TV3 #13dic #Congreso #Violencia #Barcelona http://bit.ly/2Ah1GvY ,"<p class=""TweetTextSize js-tweet-text tweet-text"" data-aria-label-part=""0"" lang=""es"">Declara otro joven por la paliza mortal al hombre que llevaba tirantes con la bandera de España <a class=""twitter-hashtag pretty-link js-nav"" data-query-source=""hashtag_click"" dir=""ltr"" href=""/hashtag/Sucesos?src=hash""><s>#</s><b>Sucesos</b></a> <a class=""twitter-hashtag pretty-link js-nav"" data-query-source=""hashtag_click"" dir=""ltr"" href=""/hashtag/Zaragoza?src=hash""><s>#</s><b>Zaragoza</b></a> <a class=""twitter-hashtag pretty-link js-nav"" data-query-source=""hashtag_click"" dir=""ltr"" href=""/hashtag/Espa%C3%B1a?src=hash""><s>#</s><b>España</b></a> <a class=""twitter-hashtag pretty-link js-nav"" data-query-source=""hashtag_click"" dir=""ltr"" href=""/hashtag/RTVE?src=hash""><s>#</s><b>RTVE</b></a> <a class=""twitter-hashtag pretty-link js-nav"" data-query-source=""hashtag_click"" dir=""ltr"" href=""/hashtag/TV3?src=hash""><s>#</s><b>TV3</b></a> <a class=""twitter-hashtag pretty-link js-nav"" data-query-source=""hashtag_click"" dir=""ltr"" href=""/hashtag/13dic?src=hash""><s>#</s><b>13dic</b></a> <a class=""twitter-hashtag pretty-link js-nav"" data-query-source=""hashtag_click"" dir=""ltr"" href=""/hashtag/Congreso?src=hash""><s>#</s><b>Congreso</b></a> <a class=""twitter-hashtag pretty-link js-nav"" data-query-source=""hashtag_click"" dir=""ltr"" href=""/hashtag/Violencia?src=hash""><s>#</s><b><strong>Violencia</strong></b></a> <a class=""twitter-hashtag pretty-link js-nav"" data-query-source=""hashtag_click"" dir=""ltr"" href=""/hashtag/Barcelona?src=hash""><s>#</s><b><strong>Barcelona</strong></b></a> <a class=""twitter-timeline-link u-hidden"" data-expanded-url=""http://bit.ly/2Ah1GvY"" dir=""ltr"" href=""https://t.co/lSos2PIceL"" rel=""nofollow noopener"" target=""_blank"" title=""http://bit.ly/2Ah1GvY""><span class=""tco-ellipsis""></span><span class=""invisible"">http://</span><span class=""js-display-url"">bit.ly/2Ah1GvY</span><span class=""invisible""></span><span class=""tco-ellipsis""><span class=""invisible""> </span></span></a></p>",['http://bit.ly/2Ah1GvY'],"['Sucesos', 'Zaragoza', 'España', 'RTVE', 'TV3', '13dic', 'Congreso', 'Violencia', 'Barcelona']",False,[],,2,4,0,False,False,,[]
122,BCNmetropoli,Metrópoli Abierta,816600493044670465,940924088016621573,/BCNmetropoli/status/940924088016621573,2017-12-13 12:39:18,1513168758,"Conversamos con Armando, que sufrió una agresión homófoba en el #Eixample de #Barcelona http://ow.ly/8qmJ30hcjgL  @OCL_H","<p class=""TweetTextSize js-tweet-text tweet-text"" data-aria-label-part=""0"" lang=""es"">Conversamos con Armando, que sufrió una <strong>agresión</strong> homófoba en el <a class=""twitter-hashtag pretty-link js-nav"" data-query-source=""hashtag_click"" dir=""ltr"" href=""/hashtag/Eixample?src=hash""><s>#</s><b>Eixample</b></a> de <a class=""twitter-hashtag pretty-link js-nav"" data-query-source=""hashtag_click"" dir=""ltr"" href=""/hashtag/Barcelona?src=hash""><s>#</s><b><strong>Barcelona</strong></b></a> <a class=""twitter-timeline-link"" data-expanded-url=""http://ow.ly/8qmJ30hcjgL"" dir=""ltr"" href=""https://t.co/XPBPQUTR5S"" rel=""nofollow noopener"" target=""_blank"" title=""http://ow.ly/8qmJ30hcjgL""><span class=""tco-ellipsis""></span><span class=""invisible"">http://</span><span class=""js-display-url"">ow.ly/8qmJ30hcjgL</span><span class=""invisible""></span><span class=""tco-ellipsis""><span class=""invisible""> </span></span></a> <a class=""twitter-atreply pretty-link js-nav"" data-mentioned-user-id=""1401782742"" dir=""ltr"" href=""/OCL_H""><s>@</s><b>OCL_H</b></a></p>",['http://ow.ly/8qmJ30hcjgL'],"['Eixample', 'Barcelona']",False,[],,0,0,0,False,False,,[]
123,RADIOPICA,Radio PICA,196524850,940917584672763904,/RADIOPICA/status/940917584672763904,2017-12-13 12:13:28,1513167208,"BARCELONA
Un guardia civil denunciado por agresión ultraderechista -
http://kaosenlared.net/un-guardia-civil-denunciado-por-agresion-ultraderechista-en-barcelona/ …","<p class=""TweetTextSize js-tweet-text tweet-text"" data-aria-label-part=""0"" lang=""es""><strong>BARCELONA</strong>
Un guardia civil denunciado por <strong>agresión</strong> ultraderechista -
<a class=""twitter-timeline-link"" data-expanded-url=""http://kaosenlared.net/un-guardia-civil-denunciado-por-agresion-ultraderechista-en-barcelona/"" dir=""ltr"" href=""https://t.co/FvLZXixmVm"" rel=""nofollow noopener"" target=""_blank"" title=""http://kaosenlared.net/un-guardia-civil-denunciado-por-agresion-ultraderechista-en-barcelona/""><span class=""tco-ellipsis""></span><span class=""invisible"">http://</span><span class=""js-display-url"">kaosenlared.net/un-guardia-civ</span><span class=""invisible"">il-denunciado-por-agresion-ultraderechista-en-barcelona/</span><span class=""tco-ellipsis""><span class=""invisible""> </span>…</span></a></p>",['http://kaosenlared.net/un-guardia-civil-denunciado-por-agresion-ultraderechista-en-barcelona/'],[],False,[],,1,0,0,False,False,,[]
124,ObservatorioDmc,Observatorio Democrático,18375955,940912143012126720,/ObservatorioDmc/status/940912143012126720,2017-12-13 11:51:50,1513165910,"El mismo circulo donde se movían chilenos del caso bombas, Francisco Solar y Monica Caballero, q una vez en España vivían en Barcelona y pusieron bomba en iglesia en Zaragoza.

En este caso Lanza vivía en Barcelona hasta 1er delito, luego d cárcel se fue a Zaragoza y 2o delito. https://twitter.com/ObservatorioDmc/status/940911437844828160 …","<p class=""TweetTextSize js-tweet-text tweet-text"" data-aria-label-part=""4"" lang=""es"">El mismo circulo donde se movían chilenos del caso bombas, Francisco Solar y Monica Caballero, q una vez en España vivían en <strong>Barcelona</strong> y pusieron bomba en iglesia en Zaragoza.

En este caso Lanza vivía en <strong>Barcelona</strong> hasta 1er <strong>delito</strong>, luego d cárcel se fue a Zaragoza y 2o <strong>delito</strong>. <a class=""twitter-timeline-link u-hidden"" data-expanded-url=""https://twitter.com/ObservatorioDmc/status/940911437844828160"" dir=""ltr"" href=""https://t.co/kpFifdZQ8y"" rel=""nofollow noopener"" target=""_blank"" title=""https://twitter.com/ObservatorioDmc/status/940911437844828160""><span class=""tco-ellipsis""></span><span class=""invisible"">https://</span><span class=""js-display-url"">twitter.com/ObservatorioDm</span><span class=""invisible"">c/status/940911437844828160</span><span class=""tco-ellipsis""><span class=""invisible""> </span>…</span></a></p>",['https://twitter.com/ObservatorioDmc/status/940911437844828160'],[],False,[],,3,9,0,False,False,,[]
125,barcelona_010,barcelona_010,263571055,940911700232097792,/barcelona_010/status/940911700232097792,2017-12-13 11:50:05,1513165805,"Intimidar, prohibir, menysprear > és violència masclista. Si necessites ajuda, truca al #SARA, 932 915 910. http://ajuntament.barcelona.cat/bcnantimasclista … #BCNantimasclistapic.twitter.com/hed4giCXx7","<p class=""TweetTextSize js-tweet-text tweet-text"" data-aria-label-part=""0"" lang=""ca"">Intimidar, prohibir, menysprear &gt; és <strong>violència</strong> masclista. Si necessites ajuda, truca al <a class=""twitter-hashtag pretty-link js-nav"" data-query-source=""hashtag_click"" dir=""ltr"" href=""/hashtag/SARA?src=hash""><s>#</s><b>SARA</b></a>, 932 915 910. <a class=""twitter-timeline-link"" data-expanded-url=""http://ajuntament.barcelona.cat/bcnantimasclista"" dir=""ltr"" href=""https://t.co/Fg4JhHnokD"" rel=""nofollow noopener"" target=""_blank"" title=""http://ajuntament.barcelona.cat/bcnantimasclista""><span class=""tco-ellipsis""></span><span class=""invisible"">http://</span><span class=""js-display-url"">ajuntament.barcelona.cat/bcnantimasclis</span><span class=""invisible"">ta</span><span class=""tco-ellipsis""><span class=""invisible""> </span>…</span></a> <a class=""twitter-hashtag pretty-link js-nav"" data-query-source=""hashtag_click"" dir=""ltr"" href=""/hashtag/BCNantimasclista?src=hash""><s>#</s><b>BCNantimasclista</b></a><a class=""twitter-timeline-link u-hidden"" data-pre-embedded=""true"" dir=""ltr"" href=""https://t.co/hed4giCXx7"">pic.twitter.com/hed4giCXx7</a></p>",['http://ajuntament.barcelona.cat/bcnantimasclista'],"['SARA', 'BCNantimasclistapic']",True,['https://pbs.twimg.com/media/DQ7KM_jXUAIPNez.jpg'],,0,0,0,False,False,,[]
126,Ivan_Puig,Ivan Puig,805734347009642497,940904012240613376,/Ivan_Puig/status/940904012240613376,2017-12-13 11:19:32,1513163972,"""¡En Barcelona soy la puta ley y se cierra el bar cuando lo diga yo!"" I tenim 4 presos polítics perquè poden generar violència i tal...
#LlibertatPresosPolítics http://www.cataladigital.cat/?p=4448  via","<p class=""TweetTextSize js-tweet-text tweet-text"" data-aria-label-part=""0"" lang=""ca"">""¡En <strong>Barcelona</strong> soy la puta ley y se cierra el bar cuando lo diga yo!"" I tenim 4 presos polítics perquè poden generar <strong>violència</strong> i tal...
<a class=""twitter-hashtag pretty-link js-nav"" data-query-source=""hashtag_click"" dir=""ltr"" href=""/hashtag/LlibertatPresosPol%C3%ADtics?src=hash""><s>#</s><b>LlibertatPresosPolítics</b></a> <a class=""twitter-timeline-link"" data-expanded-url=""http://www.cataladigital.cat/?p=4448"" dir=""ltr"" href=""https://t.co/GetoRD4Too"" rel=""nofollow noopener"" target=""_blank"" title=""http://www.cataladigital.cat/?p=4448""><span class=""tco-ellipsis""></span><span class=""invisible"">http://www.</span><span class=""js-display-url"">cataladigital.cat/?p=4448</span><span class=""invisible""></span><span class=""tco-ellipsis""><span class=""invisible""> </span></span></a> via</p>",['http://www.cataladigital.cat/?p=4448'],['LlibertatPresosPolítics'],False,[],,10,9,0,False,False,,[]
127,hdez_salcedo,Rosario Hdez,782657019618598912,940887161901109248,/hdez_salcedo/status/940887161901109248,2017-12-13 10:12:34,1513159954,El detenido por el crimen de Víctor Laínez ya cumplió condena por dejar tetrapléjico a un policía en Barcelona | Noticias de Zaragoza en Heraldo.es http://www.heraldo.es/noticias/aragon/zaragoza-provincia/zaragoza/2017/12/12/el-detenido-por-crimen-victor-lainez-cumplio-condena-por-dejar-tetraplejico-policia-barcelona-1213460-301.html …,"<p class=""TweetTextSize js-tweet-text tweet-text"" data-aria-label-part=""0"" lang=""es"">El detenido por el <strong>crimen</strong> de Víctor Laínez ya cumplió condena por dejar tetrapléjico a un policía en <strong>Barcelona</strong> | Noticias de Zaragoza en Heraldo.es <a class=""twitter-timeline-link"" data-expanded-url=""http://www.heraldo.es/noticias/aragon/zaragoza-provincia/zaragoza/2017/12/12/el-detenido-por-crimen-victor-lainez-cumplio-condena-por-dejar-tetraplejico-policia-barcelona-1213460-301.html"" dir=""ltr"" href=""https://t.co/QbKkwNVjpl"" rel=""nofollow noopener"" target=""_blank"" title=""http://www.heraldo.es/noticias/aragon/zaragoza-provincia/zaragoza/2017/12/12/el-detenido-por-crimen-victor-lainez-cumplio-condena-por-dejar-tetraplejico-policia-barcelona-1213460-301.html""><span class=""tco-ellipsis""></span><span class=""invisible"">http://www.</span><span class=""js-display-url"">heraldo.es/noticias/arago</span><span class=""invisible"">n/zaragoza-provincia/zaragoza/2017/12/12/el-detenido-por-crimen-victor-lainez-cumplio-condena-por-dejar-tetraplejico-policia-barcelona-1213460-301.html</span><span class=""tco-ellipsis""><span class=""invisible""> </span>…</span></a></p>",['http://www.heraldo.es/noticias/aragon/zaragoza-provincia/zaragoza/2017/12/12/el-detenido-por-crimen-victor-lainez-cumplio-condena-por-dejar-tetraplejico-policia-barcelona-1213460-301.html'],[],False,[],,0,0,0,False,False,,[]
