,screen_name,username,user_id,tweet_id,tweet_url,timestamp,timestamp_epochs,text,text_html,links,hashtags,has_media,img_urls,video_url,likes,retweets,replies,is_replied,is_reply_to,parent_tweet_id,reply_to_users
289,diario86com,diario86.com,3033317963,1194562853275086849,/diario86com/status/1194562853275086849,2019-11-13 10:29:12,1573640952,El PSOE insta a Torra a “evitar la violencia radical” y proteger al Rey en Barcelona https://diario6.com/el-psoe-insta-a-torra-a-evitar-la-violencia-radical-y-proteger-al-rey-en-barcelona/ …,"<p class=""TweetTextSize js-tweet-text tweet-text"" data-aria-label-part=""0"" lang=""es"">El PSOE insta a Torra a “evitar la <strong>violencia</strong> radical” y proteger al Rey en <strong>Barcelona</strong> <a class=""twitter-timeline-link u-hidden"" data-expanded-url=""https://diario6.com/el-psoe-insta-a-torra-a-evitar-la-violencia-radical-y-proteger-al-rey-en-barcelona/"" dir=""ltr"" href=""https://t.co/nr5oNUJZEV"" rel=""nofollow noopener"" target=""_blank"" title=""https://diario6.com/el-psoe-insta-a-torra-a-evitar-la-violencia-radical-y-proteger-al-rey-en-barcelona/""><span class=""tco-ellipsis""></span><span class=""invisible"">https://</span><span class=""js-display-url"">diario6.com/el-psoe-insta-</span><span class=""invisible"">a-torra-a-evitar-la-violencia-radical-y-proteger-al-rey-en-barcelona/</span><span class=""tco-ellipsis""><span class=""invisible""> </span>…</span></a></p>",['https://diario6.com/el-psoe-insta-a-torra-a-evitar-la-violencia-radical-y-proteger-al-rey-en-barcelona/'],[],False,[],,0,0,0,False,False,,[]
290,EventosJur,Eventos Jurídicos,250636895,1194559310040371200,/EventosJur/status/1194559310040371200,2019-11-13 10:15:08,1573640108,Nuevo #evento 26 de noviembre en #Barcelona Reflexiones sobre la Violencia contra la mujer en redes sociales https://eventosjuridicos.es/es/eventos/reflexiones-sobre-la-violencia-contra-la-mujer-en-redes-sociales/17082/ … @comunicacioicab @MariaEugeniaGay,"<p class=""TweetTextSize js-tweet-text tweet-text"" data-aria-label-part=""0"" lang=""es"">Nuevo <a class=""twitter-hashtag pretty-link js-nav"" data-query-source=""hashtag_click"" dir=""ltr"" href=""/hashtag/evento?src=hash""><s>#</s><b>evento</b></a> 26 de noviembre en <a class=""twitter-hashtag pretty-link js-nav"" data-query-source=""hashtag_click"" dir=""ltr"" href=""/hashtag/Barcelona?src=hash""><s>#</s><b><strong>Barcelona</strong></b></a> Reflexiones sobre la <strong>Violencia</strong> contra la mujer en redes sociales <a class=""twitter-timeline-link"" data-expanded-url=""https://eventosjuridicos.es/es/eventos/reflexiones-sobre-la-violencia-contra-la-mujer-en-redes-sociales/17082/"" dir=""ltr"" href=""https://t.co/ucVE50vw8o"" rel=""nofollow noopener"" target=""_blank"" title=""https://eventosjuridicos.es/es/eventos/reflexiones-sobre-la-violencia-contra-la-mujer-en-redes-sociales/17082/""><span class=""tco-ellipsis""></span><span class=""invisible"">https://</span><span class=""js-display-url"">eventosjuridicos.es/es/eventos/ref</span><span class=""invisible"">lexiones-sobre-la-violencia-contra-la-mujer-en-redes-sociales/17082/</span><span class=""tco-ellipsis""><span class=""invisible""> </span>…</span></a> <a class=""twitter-atreply pretty-link js-nav"" data-mentioned-user-id=""222408947"" dir=""ltr"" href=""/comunicacioicab""><s>@</s><b>comunicacioicab</b></a> <a class=""twitter-atreply pretty-link js-nav"" data-mentioned-user-id=""758430213927739392"" dir=""ltr"" href=""/MariaEugeniaGay""><s>@</s><b>MariaEugeniaGay</b></a></p>",['https://eventosjuridicos.es/es/eventos/reflexiones-sobre-la-violencia-contra-la-mujer-en-redes-sociales/17082/'],"['evento', 'Barcelona']",False,[],,0,1,0,False,False,,[]
291,vox_barcelona,VOX Barcelona,2375743544,1194550209050746881,/vox_barcelona/status/1194550209050746881,2019-11-13 09:38:58,1573637938," La España que madruga, que trabaja de noche, que le echa horas, pide respeto ante la oleada de delincuencia.

Hasta este punto llegamos en #Barcelona y Área Metropolitana. Luego que por qué @vox_es ha pegado el subidón  #EspañaSiempre pic.twitter.com/mN5pkl5I4Q","<p class=""TweetTextSize js-tweet-text tweet-text"" data-aria-label-part=""0"" lang=""es""><img alt=""🚕"" aria-label=""Emoji: Taxi"" class=""Emoji Emoji--forText"" draggable=""false"" src=""https://abs.twimg.com/emoji/v2/72x72/1f695.png"" title=""Taxi""/> La España que madruga, que trabaja de noche, que le echa horas, pide respeto ante la oleada de <strong>delincuencia</strong>.

Hasta este punto llegamos en <a class=""twitter-hashtag pretty-link js-nav"" data-query-source=""hashtag_click"" dir=""ltr"" href=""/hashtag/Barcelona?src=hash""><s>#</s><b><strong>Barcelona</strong></b></a> y Área Metropolitana. Luego que por qué <a class=""twitter-atreply pretty-link js-nav"" data-mentioned-user-id=""2201623465"" dir=""ltr"" href=""/vox_es""><s>@</s><b>vox_es</b></a> ha pegado el subidón <img alt=""🤷🏻‍♂️"" aria-label=""Emoji: Hombre encogiendo los hombros (tono de piel claro)"" class=""Emoji Emoji--forText"" draggable=""false"" src=""https://abs.twimg.com/emoji/v2/72x72/1f937-1f3fb-200d-2642-fe0f.png"" title=""Hombre encogiendo los hombros (tono de piel claro)""/> <a class=""twitter-hashtag pretty-link js-nav"" data-query-source=""hashtag_click"" dir=""ltr"" href=""/hashtag/Espa%C3%B1aSiempre?src=hash""><s>#</s><b>EspañaSiempre</b></a> <img alt=""🇪🇸"" aria-label=""Emoji: Bandera de España"" class=""Emoji Emoji--forText"" draggable=""false"" src=""https://abs.twimg.com/emoji/v2/72x72/1f1ea-1f1f8.png"" title=""Bandera de España""/><a class=""twitter-timeline-link u-hidden"" data-pre-embedded=""true"" dir=""ltr"" href=""https://t.co/mN5pkl5I4Q"">pic.twitter.com/mN5pkl5I4Q</a></p>",[],"['Barcelona', 'EspañaSiempre']",True,['https://pbs.twimg.com/media/EJPlFCPW4AAeA3i.jpg'],,80,54,4,True,False,,[]
292,MrGasolinero,Voxeador 🇪🇸💚,1194356441030762498,1194536998331125760,/MrGasolinero/status/1194536998331125760,2019-11-13 08:46:28,1573634788,"El fascismo no es a día de hoy la izquierda? Buscan un régimen totalitario y antidemocrático (véase violencia en barcelona). Vamos, si no tienes las ideas totalitarias de la izquierda, por descarte eres fascista?","<p class=""TweetTextSize js-tweet-text tweet-text"" data-aria-label-part=""0"" lang=""es"">El fascismo no es a día de hoy la izquierda? Buscan un régimen totalitario y antidemocrático (véase <strong>violencia</strong> en <strong>barcelona</strong>). Vamos, si no tienes las ideas totalitarias de la izquierda, por descarte eres fascista?</p>",[],[],False,[],,1,0,2,True,True,1194503693523210241,"[{'screen_name': 'mgarcruz', 'user_id': '1156974930602418176'}]"
293,Betancourtcom1,Betancourt.com,1013446058712731650,1194532105012809728,/Betancourtcom1/status/1194532105012809728,2019-11-13 08:27:01,1573633621,"bueno tenemos a los CDR CON ACTOS TERRORISTAS QUE POR SUERTE NO LLEGARON A PERPETUARLO, soy  de Barcelona y vi con mis ojos la violencia de estos cobardes mandados por torra, y mis vecinos me amenazan con denuncia puesta ya por mi por tener bandera española, violentos si y mucho","<p class=""TweetTextSize js-tweet-text tweet-text"" data-aria-label-part=""0"" lang=""es"">bueno tenemos a los CDR CON ACTOS TERRORISTAS QUE POR SUERTE NO LLEGARON A PERPETUARLO, soy  de <strong>Barcelona</strong> y vi con mis ojos la <strong>violencia</strong> de estos cobardes mandados por torra, y mis vecinos me amenazan con denuncia puesta ya por mi por tener bandera española, violentos si y mucho</p>",[],[],False,[],,0,0,1,True,True,1193815006342733824,"[{'screen_name': 'oalsinav', 'user_id': '38133472'}, {'screen_name': 'JoanIgnasi5', 'user_id': '910894846944129024'}]"
294,sap_pl,SAP-PL,2896445033,1194529023218593792,/sap_pl/status/1194529023218593792,2019-11-13 08:14:47,1573632887,"El próximo domingo 17 de noviembre,  conmemoramos el Día Mundial en Recuerdo de las Víctimas de la Violencia Vial.  Adjuntamos programa,  os esperamos,  #SalvandoVidas en 
Barcelona,  Madrid,  Granada,  Jaén,  Zaragoza,  A Coruña,  Donostia,  Valencia,  Valladolid, Ourense... https://twitter.com/stopaccidentes/status/1194325159873785859 …","<p class=""TweetTextSize js-tweet-text tweet-text"" data-aria-label-part=""4"" lang=""es"">El próximo domingo 17 de noviembre,  conmemoramos el Día Mundial en Recuerdo de las Víctimas de la <strong>Violencia</strong> Vial.  Adjuntamos programa,  os esperamos,  <a class=""twitter-hashtag pretty-link js-nav"" data-query-source=""hashtag_click"" dir=""ltr"" href=""/hashtag/SalvandoVidas?src=hash""><s>#</s><b>SalvandoVidas</b></a> en 
<strong>Barcelona</strong>,  Madrid,  Granada,  Jaén,  Zaragoza,  A Coruña,  Donostia,  Valencia,  Valladolid, Ourense... <a class=""twitter-timeline-link u-hidden"" data-expanded-url=""https://twitter.com/stopaccidentes/status/1194325159873785859"" dir=""ltr"" href=""https://t.co/Phs0rBBO5A"" rel=""nofollow noopener"" target=""_blank"" title=""https://twitter.com/stopaccidentes/status/1194325159873785859""><span class=""tco-ellipsis""></span><span class=""invisible"">https://</span><span class=""js-display-url"">twitter.com/stopaccidentes</span><span class=""invisible"">/status/1194325159873785859</span><span class=""tco-ellipsis""><span class=""invisible""> </span>…</span></a></p>",['https://twitter.com/stopaccidentes/status/1194325159873785859'],['SalvandoVidas'],False,[],,1,0,0,False,False,,[]
295,CCElSortidor,CC El Sortidor,413273456,1194527333270589440,/CCElSortidor/status/1194527333270589440,2019-11-13 08:08:04,1573632484,"Als barris de @BCN_SantsMont, com a la resta de Barcelona, organitzem un munt d'activitats contra la violencia masclista durant el mes de novembre. 

 Enguany són 37 activitats en 18 equipaments diferents, que ja podeu consultar: http://bit.ly/34UosbR 
#BCNAntimasclista #25Npic.twitter.com/GqMp6wSM1y","<p class=""TweetTextSize js-tweet-text tweet-text"" data-aria-label-part=""0"" lang=""ca"">Als barris de <a class=""twitter-atreply pretty-link js-nav"" data-mentioned-user-id=""93836518"" dir=""ltr"" href=""/BCN_SantsMont""><s>@</s><b>BCN_SantsMont</b></a>, com a la resta de <strong>Barcelona</strong>, organitzem un munt d'activitats contra la <strong>violencia</strong> masclista durant el mes de novembre. 

<img alt=""📅"" aria-label=""Emoji: Calendario"" class=""Emoji Emoji--forText"" draggable=""false"" src=""https://abs.twimg.com/emoji/v2/72x72/1f4c5.png"" title=""Calendario""/> Enguany són 37 activitats en 18 equipaments diferents, que ja podeu consultar: <a class=""twitter-timeline-link"" data-expanded-url=""http://bit.ly/34UosbR"" dir=""ltr"" href=""https://t.co/IyOZ2sjv4g"" rel=""nofollow noopener"" target=""_blank"" title=""http://bit.ly/34UosbR""><span class=""tco-ellipsis""></span><span class=""invisible"">http://</span><span class=""js-display-url"">bit.ly/34UosbR</span><span class=""invisible""></span><span class=""tco-ellipsis""><span class=""invisible""> </span></span></a>
<a class=""twitter-hashtag pretty-link js-nav"" data-query-source=""hashtag_click"" dir=""ltr"" href=""/hashtag/BCNAntimasclista?src=hash""><s>#</s><b>BCNAntimasclista</b></a> <a class=""twitter-hashtag pretty-link js-nav"" data-query-source=""hashtag_click"" dir=""ltr"" href=""/hashtag/25N?src=hash""><s>#</s><b>25N</b></a><a class=""twitter-timeline-link u-hidden"" data-pre-embedded=""true"" dir=""ltr"" href=""https://t.co/GqMp6wSM1y"">pic.twitter.com/GqMp6wSM1y</a></p>",['http://bit.ly/34UosbR'],"['BCNAntimasclista', '25Npic']",True,['https://pbs.twimg.com/media/EJPQRaqWsAALnWc.jpg'],,5,2,0,False,False,,[]
296,Luydj,Fotos Servian,240802850,1194526616853958656,/Luydj/status/1194526616853958656,2019-11-13 08:05:13,1573632313,Agresión en el metro de Barcelona por llevar una bandera y una gorra españolas https://trib.al/tAsWKMq ,"<p class=""TweetTextSize js-tweet-text tweet-text"" data-aria-label-part=""0"" lang=""es""><strong>Agresión</strong> en el metro de <strong>Barcelona</strong> por llevar una bandera y una gorra españolas <a class=""twitter-timeline-link u-hidden"" data-expanded-url=""https://trib.al/tAsWKMq"" dir=""ltr"" href=""https://t.co/gTA3psAA6q"" rel=""nofollow noopener"" target=""_blank"" title=""https://trib.al/tAsWKMq""><span class=""tco-ellipsis""></span><span class=""invisible"">https://</span><span class=""js-display-url"">trib.al/tAsWKMq</span><span class=""invisible""></span><span class=""tco-ellipsis""><span class=""invisible""> </span></span></a></p>",['https://trib.al/tAsWKMq'],[],False,[],,0,0,0,False,False,,[]
297,Roto031,Alex Crochet,872847495143071745,1194524769682698241,/Roto031/status/1194524769682698241,2019-11-13 07:57:52,1573631872,"Madre mia como estamos.. Si los trabajadores de aena hacen huelga y medio cierran el aerepuerto, no pasa nada, lo hacen los indepen y es un delito.. Taxistas en Barcelona tirando adoquines a uber y cabify en el cinturon del litoral y no pasa nada, lo hacen los indepes y delito..","<p class=""TweetTextSize js-tweet-text tweet-text"" data-aria-label-part=""0"" lang=""es"">Madre mia como estamos.. Si los trabajadores de aena hacen huelga y medio cierran el aerepuerto, no pasa nada, lo hacen los indepen y es un <strong>delito</strong>.. Taxistas en <strong>Barcelona</strong> tirando adoquines a uber y cabify en el cinturon del litoral y no pasa nada, lo hacen los indepes y <strong>delito</strong>..</p>",[],[],False,[],,0,0,0,False,True,1194262959494778883,"[{'screen_name': 'TabarniaResist1', 'user_id': '1155409385465794560'}, {'screen_name': 'mossos', 'user_id': '110946158'}]"
298,barcelona_GUB,Guàrdia Urbana Barcelona,442728468,1194519017769373696,/barcelona_GUB/status/1194519017769373696,2019-11-13 07:35:01,1573630501,"Un incendi destapa una plantació de marihuana en un pis del #Raval. S'han comissat més de 1.700 esqueixos i una persona ha quedat investigada per un presumpte delicte contra la salut publica i defraudació de fluid elèctric.
 http://ow.ly/oqPE50x9uaF 
#gubUI #gubCVpic.twitter.com/87u6E86Hxd","<p class=""TweetTextSize js-tweet-text tweet-text"" data-aria-label-part=""0"" lang=""ca"">Un incendi destapa una plantació de marihuana en un pis del <a class=""twitter-hashtag pretty-link js-nav"" data-query-source=""hashtag_click"" dir=""ltr"" href=""/hashtag/Raval?src=hash""><s>#</s><b>Raval</b></a>. S'han comissat més de 1.700 esqueixos i una persona ha quedat investigada per un presumpte <strong>delicte</strong> contra la salut publica i defraudació de fluid elèctric.
<img alt=""👉"" aria-label=""Emoji: Dorso de la mano con el dedo índice señalando hacia la derecha"" class=""Emoji Emoji--forText"" draggable=""false"" src=""https://abs.twimg.com/emoji/v2/72x72/1f449.png"" title=""Dorso de la mano con el dedo índice señalando hacia la derecha""/> <a class=""twitter-timeline-link"" data-expanded-url=""http://ow.ly/oqPE50x9uaF"" dir=""ltr"" href=""https://t.co/T2N95H8U90"" rel=""nofollow noopener"" target=""_blank"" title=""http://ow.ly/oqPE50x9uaF""><span class=""tco-ellipsis""></span><span class=""invisible"">http://</span><span class=""js-display-url"">ow.ly/oqPE50x9uaF</span><span class=""invisible""></span><span class=""tco-ellipsis""><span class=""invisible""> </span></span></a>
<a class=""twitter-hashtag pretty-link js-nav"" data-query-source=""hashtag_click"" dir=""ltr"" href=""/hashtag/gubUI?src=hash""><s>#</s><b>gubUI</b></a> <a class=""twitter-hashtag pretty-link js-nav"" data-query-source=""hashtag_click"" dir=""ltr"" href=""/hashtag/gubCV?src=hash""><s>#</s><b>gubCV</b></a><a class=""twitter-timeline-link u-hidden"" data-pre-embedded=""true"" dir=""ltr"" href=""https://t.co/87u6E86Hxd"">pic.twitter.com/87u6E86Hxd</a></p>",['http://ow.ly/oqPE50x9uaF'],"['Raval', 'gubUI', 'gubCVpic']",True,['https://pbs.twimg.com/media/EJPIt1ZX0AA7LGR.jpg'],,15,8,2,True,False,,[]
299,da_so_az,David 🎗,762210678954483712,1194505569199112192,/da_so_az/status/1194505569199112192,2019-11-13 06:41:35,1573627295,"Ahir diferents talls a Barcelona amb barricades. La BRIMO, PN i GC repartits per Catalunya pels talls de l'autopista. Ni un sol aldarull a la ciutat. A les 23-23:30 els manifestants cap a casa i tot torna a la normalitzat. Qui crea la violència?","<p class=""TweetTextSize js-tweet-text tweet-text"" data-aria-label-part=""0"" lang=""ca"">Ahir diferents talls a <strong>Barcelona</strong> amb barricades. La BRIMO, PN i GC repartits per Catalunya pels talls de l'autopista. Ni un sol aldarull a la ciutat. A les 23-23:30 els manifestants cap a casa i tot torna a la normalitzat. Qui crea la <strong>violència</strong>?</p>",[],[],False,[],,2,0,0,False,False,,[]
300,AnaMari32869400,Ana Mari,1040912116897800192,1194487217881862146,/AnaMari32869400/status/1194487217881862146,2019-11-13 05:28:39,1573622919,"Ayer me robaron la cartera en Barcelona, además del dinero toda la documentación, incluida mi tarjeta de Vox. La inseguridad q tenemos es brutal y ahora este Gobierno de mierda! ‍‍‍","<p class=""TweetTextSize js-tweet-text tweet-text"" data-aria-label-part=""0"" lang=""es"">Ayer me robaron la cartera en <strong>Barcelona</strong>, además del dinero toda la documentación, incluida mi tarjeta de Vox. La <strong>inseguridad</strong> q tenemos es brutal y ahora este Gobierno de mierda! <img alt=""😫"" aria-label=""Emoji: Cara cansada"" class=""Emoji Emoji--forText"" draggable=""false"" src=""https://abs.twimg.com/emoji/v2/72x72/1f62b.png"" title=""Cara cansada""/><img alt=""🤦"" aria-label=""Emoji: Person facepalming"" class=""Emoji Emoji--forText"" draggable=""false"" src=""https://abs.twimg.com/emoji/v2/72x72/1f926.png"" title=""Person facepalming""/>‍<img alt=""♀"" aria-label=""Emoji: Signo femenino"" class=""Emoji Emoji--forText"" draggable=""false"" src=""https://abs.twimg.com/emoji/v2/72x72/2640.png"" title=""Signo femenino""/><img alt=""🤦"" aria-label=""Emoji: Person facepalming"" class=""Emoji Emoji--forText"" draggable=""false"" src=""https://abs.twimg.com/emoji/v2/72x72/1f926.png"" title=""Person facepalming""/>‍<img alt=""♀"" aria-label=""Emoji: Signo femenino"" class=""Emoji Emoji--forText"" draggable=""false"" src=""https://abs.twimg.com/emoji/v2/72x72/2640.png"" title=""Signo femenino""/><img alt=""🤦"" aria-label=""Emoji: Person facepalming"" class=""Emoji Emoji--forText"" draggable=""false"" src=""https://abs.twimg.com/emoji/v2/72x72/1f926.png"" title=""Person facepalming""/>‍<img alt=""♀"" aria-label=""Emoji: Signo femenino"" class=""Emoji Emoji--forText"" draggable=""false"" src=""https://abs.twimg.com/emoji/v2/72x72/2640.png"" title=""Signo femenino""/></p>",[],[],False,[],,0,0,0,False,True,1194486501117222912,"[{'screen_name': 'laysurcan', 'user_id': '534036988'}]"
301,ConyazoMas,Esteban G R,3435795754,1194480667284922368,/ConyazoMas/status/1194480667284922368,2019-11-13 05:02:38,1573621358,"La cuestión es q cualquier ciudadano, uno sólo, al hacer esto empieza algo q no se sabe adónde te lleva, en mi opinión a  imputación a Torra y Puchi por un delito d Rebelión.
La prevaricación de @AdaColau con 40 niñatos cortando las calles cada día con @barcelona_GUB, también ","<p class=""TweetTextSize js-tweet-text tweet-text"" data-aria-label-part=""0"" lang=""es"">La cuestión es q cualquier ciudadano, uno sólo, al hacer esto empieza algo q no se sabe adónde te lleva, en mi opinión a  imputación a Torra y Puchi por un <strong>delito</strong> d Rebelión.
La prevaricación de <a class=""twitter-atreply pretty-link js-nav"" data-mentioned-user-id=""102095809"" dir=""ltr"" href=""/AdaColau""><s>@</s><b>AdaColau</b></a> con 40 niñatos cortando las calles cada día con <a class=""twitter-atreply pretty-link js-nav"" data-mentioned-user-id=""442728468"" dir=""ltr"" href=""/barcelona_GUB""><s>@</s><b><strong>barcelona</strong>_GUB</b></a>, también <img alt=""👍"" aria-label=""Emoji: Thumbs up"" class=""Emoji Emoji--forText"" draggable=""false"" src=""https://abs.twimg.com/emoji/v2/72x72/1f44d.png"" title=""Thumbs up""/></p>",[],[],False,[],,0,0,1,True,True,1194396579769331712,"[{'screen_name': 'ConyazoMas', 'user_id': '3435795754'}, {'screen_name': 'Juan_Barquilla', 'user_id': '181171171'}]"
302,Elandaluzcatal1,Elandaluzcatalan,1081067053052776450,1194418763145179136,/Elandaluzcatal1/status/1194418763145179136,2019-11-13 00:56:39,1573606599,"Pues como lo hagan igual de bien q tú en Barcelona con la delincuencia, las políticas sociales, la economía, etc las llevamos clara guapa!","<p class=""TweetTextSize js-tweet-text tweet-text"" data-aria-label-part=""0"" lang=""es"">Pues como lo hagan igual de bien q tú en <strong>Barcelona</strong> con la <strong>delincuencia</strong>, las políticas sociales, la economía, etc las llevamos clara guapa!</p>",[],[],False,[],,1,0,0,False,True,1194245173498327041,"[{'screen_name': 'AdaColau', 'user_id': '102095809'}]"
303,Marcos88474290,Marcos,1106745053303705607,1194409982978088960,/Marcos88474290/status/1194409982978088960,2019-11-13 00:21:45,1573604505,"Cien apuñalados en un año: las escandalosas cifras de la violencia en Barcelona
https://www.metropoliabierta.com/el-pulso-de-la-ciudad/sucesos/barcelona-apunalados-cifra-violencia_19970_102_amp.html?__twitter_impression=true …","<p class=""TweetTextSize js-tweet-text tweet-text"" data-aria-label-part=""0"" lang=""es"">Cien apuñalados en un año: las escandalosas cifras de la <strong>violencia</strong> en <strong>Barcelona</strong>
<a class=""twitter-timeline-link u-hidden"" data-expanded-url=""https://www.metropoliabierta.com/el-pulso-de-la-ciudad/sucesos/barcelona-apunalados-cifra-violencia_19970_102_amp.html?__twitter_impression=true"" dir=""ltr"" href=""https://t.co/wTnmwlepyc"" rel=""nofollow noopener"" target=""_blank"" title=""https://www.metropoliabierta.com/el-pulso-de-la-ciudad/sucesos/barcelona-apunalados-cifra-violencia_19970_102_amp.html?__twitter_impression=true""><span class=""tco-ellipsis""></span><span class=""invisible"">https://www.</span><span class=""js-display-url"">metropoliabierta.com/el-pulso-de-la</span><span class=""invisible"">-ciudad/sucesos/barcelona-apunalados-cifra-violencia_19970_102_amp.html?__twitter_impression=true</span><span class=""tco-ellipsis""><span class=""invisible""> </span>…</span></a></p>",['https://www.metropoliabierta.com/el-pulso-de-la-ciudad/sucesos/barcelona-apunalados-cifra-violencia_19970_102_amp.html?__twitter_impression=true'],[],False,[],,0,0,0,False,False,,[]
304,JosCarlosOrtiz,José Carlos Ortiz,392308968,1194041821640495105,/JosCarlosOrtiz/status/1194041821640495105,2019-11-11 23:58:49,1573516729,Agresión en el metro de Barcelona por llevar una bandera y una gorra españolas https://trib.al/tAsWKMq ,"<p class=""TweetTextSize js-tweet-text tweet-text"" data-aria-label-part=""0"" lang=""es""><strong>Agresión</strong> en el metro de <strong>Barcelona</strong> por llevar una bandera y una gorra españolas <a class=""twitter-timeline-link u-hidden"" data-expanded-url=""https://trib.al/tAsWKMq"" dir=""ltr"" href=""https://t.co/gLI8yoHmMH"" rel=""nofollow noopener"" target=""_blank"" title=""https://trib.al/tAsWKMq""><span class=""tco-ellipsis""></span><span class=""invisible"">https://</span><span class=""js-display-url"">trib.al/tAsWKMq</span><span class=""invisible""></span><span class=""tco-ellipsis""><span class=""invisible""> </span></span></a></p>",['https://trib.al/tAsWKMq'],[],False,[],,0,0,0,False,False,,[]
305,Jesferspain,jesferspain,1215507781,1194038399218454528,/Jesferspain/status/1194038399218454528,2019-11-11 23:45:13,1573515913,"3% peaje de la corrupción en Cataluña, perdiendo empresas, quemando Barcelona, instalando una violencia de republica bananera, casi al margen de la ley... PP devolverá en breve democracia y prosperidad a nuestra querida Cataluña junto a resto partidos constitucionalistas","<p class=""TweetTextSize js-tweet-text tweet-text"" data-aria-label-part=""0"" lang=""es"">3% peaje de la corrupción en Cataluña, perdiendo empresas, quemando <strong>Barcelona</strong>, instalando una <strong>violencia</strong> de republica bananera, casi al margen de la ley... PP devolverá en breve democracia y prosperidad a nuestra querida Cataluña junto a resto partidos constitucionalistas<img alt=""👍"" aria-label=""Emoji: Thumbs up"" class=""Emoji Emoji--forText"" draggable=""false"" src=""https://abs.twimg.com/emoji/v2/72x72/1f44d.png"" title=""Thumbs up""/><img alt=""🇪🇸"" aria-label=""Emoji: Bandera de España"" class=""Emoji Emoji--forText"" draggable=""false"" src=""https://abs.twimg.com/emoji/v2/72x72/1f1ea-1f1f8.png"" title=""Bandera de España""/></p>",[],[],False,[],,0,0,0,False,True,1193674970938986497,"[{'screen_name': 'Feli95223255', 'user_id': '1035859457828368384'}, {'screen_name': 'pablocasado_', 'user_id': '523386042'}]"
306,95_eduu12,Edu_95,1548360276,1194038178790957057,/95_eduu12/status/1194038178790957057,2019-11-11 23:44:20,1573515860,Agresión en el metro de Barcelona por llevar una bandera y una gorra españolas https://trib.al/tAsWKMq ,"<p class=""TweetTextSize js-tweet-text tweet-text"" data-aria-label-part=""0"" lang=""es""><strong>Agresión</strong> en el metro de <strong>Barcelona</strong> por llevar una bandera y una gorra españolas <a class=""twitter-timeline-link"" data-expanded-url=""https://trib.al/tAsWKMq"" dir=""ltr"" href=""https://t.co/C33QpRF6QA"" rel=""nofollow noopener"" target=""_blank"" title=""https://trib.al/tAsWKMq""><span class=""tco-ellipsis""></span><span class=""invisible"">https://</span><span class=""js-display-url"">trib.al/tAsWKMq</span><span class=""invisible""></span><span class=""tco-ellipsis""><span class=""invisible""> </span></span></a></p>",['https://trib.al/tAsWKMq'],[],False,[],,0,0,0,False,False,,[]
