,screen_name,username,user_id,tweet_id,tweet_url,timestamp,timestamp_epochs,text,text_html,links,hashtags,has_media,img_urls,video_url,likes,retweets,replies,is_replied,is_reply_to,parent_tweet_id,reply_to_users
452,Digitaldeleon,Digital de León,278010688,1195061532566138881,/Digitaldeleon/status/1195061532566138881,2019-11-14 19:30:47,1573759847,La verdad sobre el vídeo de una agresión a dos Guardias Civiles en Barcelona https://digitaldeleon.com/internacional/2019/11/14/la-verdad-sobre-el-video-de-una-agresion-a-dos-guardias-civiles-en-barcelona/ …pic.twitter.com/p0bPf70BLt,"<p class=""TweetTextSize js-tweet-text tweet-text"" data-aria-label-part=""0"" lang=""es"">La verdad sobre el vídeo de una <strong>agresión</strong> a dos Guardias Civiles en <strong>Barcelona</strong> <a class=""twitter-timeline-link"" data-expanded-url=""https://digitaldeleon.com/internacional/2019/11/14/la-verdad-sobre-el-video-de-una-agresion-a-dos-guardias-civiles-en-barcelona/"" dir=""ltr"" href=""https://t.co/69aOMkTzLc"" rel=""nofollow noopener"" target=""_blank"" title=""https://digitaldeleon.com/internacional/2019/11/14/la-verdad-sobre-el-video-de-una-agresion-a-dos-guardias-civiles-en-barcelona/""><span class=""tco-ellipsis""></span><span class=""invisible"">https://</span><span class=""js-display-url"">digitaldeleon.com/internacional/</span><span class=""invisible"">2019/11/14/la-verdad-sobre-el-video-de-una-agresion-a-dos-guardias-civiles-en-barcelona/</span><span class=""tco-ellipsis""><span class=""invisible""> </span>…</span></a><a class=""twitter-timeline-link u-hidden"" data-pre-embedded=""true"" dir=""ltr"" href=""https://t.co/p0bPf70BLt"">pic.twitter.com/p0bPf70BLt</a></p>",['https://digitaldeleon.com/internacional/2019/11/14/la-verdad-sobre-el-video-de-una-agresion-a-dos-guardias-civiles-en-barcelona/'],[],True,['https://pbs.twimg.com/media/EJW2IVxXsAE5CZs.jpg'],,0,0,0,False,False,,[]
453,LaPepa55932071,🇪🇸BRIMO🇪🇸,1004084078549848066,1195061008244580353,/LaPepa55932071/status/1195061008244580353,2019-11-14 19:28:42,1573759722,"Como es posible que la gente corte las vías y no se les imponga o una infracción administrativa al Reglamento General de Circulación, o se instruyan diligencias por el delito del 385 del código penal???
Veo dejación de funciones por parte de los funcionarios públicos.","<p class=""TweetTextSize js-tweet-text tweet-text"" data-aria-label-part=""0"" lang=""es"">Como es posible que la gente corte las vías y no se les imponga o una infracción administrativa al Reglamento General de Circulación, o se instruyan diligencias por el <strong>delito</strong> del 385 del código penal???
Veo dejación de funciones por parte de los funcionarios públicos.</p>",[],[],False,[],,3,0,0,False,True,1195057275418873857,"[{'screen_name': 'barcelona_GUB', 'user_id': '442728468'}, {'screen_name': 'mossos', 'user_id': '110946158'}]"
454,Mince_00,Mince,930847787633315840,1195053334824128512,/Mince_00/status/1195053334824128512,2019-11-14 18:58:12,1573757892,"Si no fuera por la calzada sin asfaltar, se podría pensar en alguna calle de Gerona o Barcelona. El titular es: orgía de fuego y destrucción en Chile contra los símbolos de poder. Es irónico que es Sr. Iglesias condene esa violencia y la que sucede en Cataluña, no. pic.twitter.com/yfIM6Hz7cX","<p class=""TweetTextSize js-tweet-text tweet-text"" data-aria-label-part=""0"" lang=""es"">Si no fuera por la calzada sin asfaltar, se podría pensar en alguna calle de Gerona o <strong>Barcelona</strong>. El titular es: orgía de fuego y destrucción en Chile contra los símbolos de poder. Es irónico que es Sr. Iglesias condene esa <strong>violencia</strong> y la que sucede en Cataluña, no. <a class=""twitter-timeline-link u-hidden"" data-pre-embedded=""true"" dir=""ltr"" href=""https://t.co/yfIM6Hz7cX"">pic.twitter.com/yfIM6Hz7cX</a></p>",[],[],True,['https://pbs.twimg.com/media/EJWuqwqWkAck7G-.jpg'],,0,0,0,False,False,,[]
455,chuliano222,Tio collons,83586365,1195052832866684928,/chuliano222/status/1195052832866684928,2019-11-14 18:56:13,1573757773," Dos agents de la Policia Nacional, a judici per agredir ( delicte contra la integritat moral) al Roger, un jove de Premià i ex-militant d'Arran en 2017.

 Durant una manifestació antifeixista en novembre de 2017 a #Barcelona dos agents de la Policia Nacional van identificar","<p class=""TweetTextSize js-tweet-text tweet-text"" data-aria-label-part=""0"" lang=""ca""><img alt=""⚠️"" aria-label=""Emoji: Señal de peligro"" class=""Emoji Emoji--forText"" draggable=""false"" src=""https://abs.twimg.com/emoji/v2/72x72/26a0.png"" title=""Señal de peligro""/> Dos agents de la Policia Nacional, a judici per agredir ( <strong>delicte</strong> contra la integritat moral) al Roger, un jove de Premià i ex-militant d'Arran en 2017.

<img alt=""➡️"" aria-label=""Emoji: Flecha hacia la derecha"" class=""Emoji Emoji--forText"" draggable=""false"" src=""https://abs.twimg.com/emoji/v2/72x72/27a1.png"" title=""Flecha hacia la derecha""/> Durant una manifestació antifeixista en novembre de 2017 a <a class=""twitter-hashtag pretty-link js-nav"" data-query-source=""hashtag_click"" dir=""ltr"" href=""/hashtag/Barcelona?src=hash""><s>#</s><b><strong>Barcelona</strong></b></a> dos agents de la Policia Nacional van identificar</p>",[],['Barcelona'],False,[],,1,1,0,False,False,,[]
456,Allogar77,Zodiac ♋🐍,387298254,1195041398325731328,/Allogar77/status/1195041398325731328,2019-11-14 18:10:46,1573755046,"Un supremacista en la presidencia, una antigua okupa sin oficio ni beneficio en la alcaldía, ninis ocupando estaciones y cortando autopistas, violencia callejera y #TsunamiTerrorista. Barcelona lo tiene todo en este momento. ¿Qué les pasa a los del Mobile?","<p class=""TweetTextSize js-tweet-text tweet-text"" data-aria-label-part=""0"" lang=""es"">Un supremacista en la presidencia, una antigua okupa sin oficio ni beneficio en la alcaldía, ninis ocupando estaciones y cortando autopistas, <strong>violencia</strong> callejera y <a class=""twitter-hashtag pretty-link js-nav"" data-query-source=""hashtag_click"" dir=""ltr"" href=""/hashtag/TsunamiTerrorista?src=hash""><s>#</s><b>TsunamiTerrorista</b></a>. <strong>Barcelona</strong> lo tiene todo en este momento. ¿Qué les pasa a los del Mobile?</p>",[],['TsunamiTerrorista'],False,[],,12,3,1,True,True,1195038274475233281,"[{'screen_name': 'LaVecinita_V', 'user_id': '992821368180879362'}, {'screen_name': 'AdaColau', 'user_id': '102095809'}]"
457,TodaNada,TODA LA VERDAD Y NADA MÁS QUE LA VERDAD,1092896655760871425,1195036697324589056,/TodaNada/status/1195036697324589056,2019-11-14 17:52:06,1573753926,"Moltes gràcies
A veure si la Policia Nacional és deixa de prejudicis ja perquè molts patim el seu terrible desconeixement

També discriminen per discapacitada,víctima de violència,dóna i mare,i el més trist el mal que fan en contra de les Lleis, dels nostres Drets i de la veritat","<p class=""TweetTextSize js-tweet-text tweet-text"" data-aria-label-part=""0"" lang=""ca"">Moltes gràcies
A veure si la Policia Nacional és deixa de prejudicis ja perquè molts patim el seu terrible desconeixement

També discriminen per discapacitada,víctima de <strong>violència</strong>,dóna i mare,i el més trist el mal que fan en contra de les Lleis, dels nostres Drets i de la veritat</p>",[],[],False,[],,0,0,0,False,True,1194719193486282752,"[{'screen_name': 'TonVieira9', 'user_id': '1151765238859096064'}, {'screen_name': 'mossos', 'user_id': '110946158'}]"
458,munts233,Jaume,833010164957605892,1195029100362121216,/munts233/status/1195029100362121216,2019-11-14 17:21:54,1573752114,"Barcelona i altres parts de Catalunya estan sota un estat policial. Un sol ull ""buidat"" per una bala de la policia hauria de ser suficient per protestar contra la violència de l'Estat.","<p class=""TweetTextSize js-tweet-text tweet-text"" data-aria-label-part=""0"" lang=""ca""><strong>Barcelona</strong> i altres parts de Catalunya estan sota un estat policial. Un sol ull ""buidat"" per una bala de la policia hauria de ser suficient per protestar contra la <strong>violència</strong> de l'Estat.</p>",[],[],False,[],,0,0,0,False,True,1194350821879754753,"[{'screen_name': 'llfoix', 'user_id': '232167357'}, {'screen_name': 'maria_llado', 'user_id': '245938556'}]"
459,CatEnComu,Catalunya En Comú,799293029353984000,1195025191170199560,/CatEnComu/status/1195025191170199560,2019-11-14 17:06:22,1573751182,"Mentre la UE i la majoria de mitjans miren cap a un altre costat, la violència i la repressió continuen creixent a #Bolívia després del cop d'estat il·legítim.

Aquest dissabte, ens trobem a Barcelona per la pau i en defensa dels drets i llibertats del poble bolivià  pic.twitter.com/pcoZb4W1i2","<p class=""TweetTextSize js-tweet-text tweet-text"" data-aria-label-part=""0"" lang=""ca"">Mentre la UE i la majoria de mitjans miren cap a un altre costat, la <strong>violència</strong> i la repressió continuen creixent a <a class=""twitter-hashtag pretty-link js-nav"" data-query-source=""hashtag_click"" dir=""ltr"" href=""/hashtag/Bol%C3%ADvia?src=hash""><s>#</s><b>Bolívia</b></a> després del cop d'estat il·legítim.

Aquest dissabte, ens trobem a <strong>Barcelona</strong> per la pau i en defensa dels drets i llibertats del poble bolivià <img alt=""👇"" aria-label=""Emoji: Dorso de la mano con el dedo índice señalando hacia abajo"" class=""Emoji Emoji--forText"" draggable=""false"" src=""https://abs.twimg.com/emoji/v2/72x72/1f447.png"" title=""Dorso de la mano con el dedo índice señalando hacia abajo""/> <a class=""twitter-timeline-link u-hidden"" data-pre-embedded=""true"" dir=""ltr"" href=""https://t.co/pcoZb4W1i2"">pic.twitter.com/pcoZb4W1i2</a></p>",[],['Bolívia'],True,['https://pbs.twimg.com/media/EJWVEsDWoAMB6ot.jpg'],,13,8,0,False,False,,[]
460,tutiwy69,Mònica🎗🎗🎗🎗,2869326059,1195011570058838018,/tutiwy69/status/1195011570058838018,2019-11-14 16:12:15,1573747935,"Sento dir això, però m'han robat amb violència 4 vegades a Barcelona nois amb la mateixa imatge del seu fill. Cada vegada que se m'acosta un noi així al metro o a l'autobús jo tinc molta por, i no és culpa ni del seu fill però molt menys meva https://twitter.com/montsepoblet/status/1194674298033770497 …","<p class=""TweetTextSize js-tweet-text tweet-text"" data-aria-label-part=""4"" lang=""ca"">Sento dir això, però m'han robat amb <strong>violència</strong> 4 vegades a <strong>Barcelona</strong> nois amb la mateixa imatge del seu fill. Cada vegada que se m'acosta un noi així al metro o a l'autobús jo tinc molta por, i no és culpa ni del seu fill però molt menys meva <a class=""twitter-timeline-link u-hidden"" data-expanded-url=""https://twitter.com/montsepoblet/status/1194674298033770497"" dir=""ltr"" href=""https://t.co/iKAaelS4Vi"" rel=""nofollow noopener"" target=""_blank"" title=""https://twitter.com/montsepoblet/status/1194674298033770497""><span class=""tco-ellipsis""></span><span class=""invisible"">https://</span><span class=""js-display-url"">twitter.com/montsepoblet/s</span><span class=""invisible"">tatus/1194674298033770497</span><span class=""tco-ellipsis""><span class=""invisible""> </span>…</span></a></p>",['https://twitter.com/montsepoblet/status/1194674298033770497'],[],False,[],,0,0,0,False,False,,[]
461,decibelsbels,Alba Cánovas,273314011,1195008784806088706,/decibelsbels/status/1195008784806088706,2019-11-14 16:01:11,1573747271,"doncs això. La identificació per perfil racial existeix, i és il·legal, doncs 1) si no hi ha delicte no tenen per què parar-te, i 2) ens haurien de tractar a tots per igual. Aquestes parades per perfil ètnic les fan per tancar a persones a CIEs i deportar-les del país.","<p class=""TweetTextSize js-tweet-text tweet-text"" data-aria-label-part=""0"" lang=""ca"">doncs això. La identificació per perfil racial existeix, i és il·legal, doncs 1) si no hi ha <strong>delicte</strong> no tenen per què parar-te, i 2) ens haurien de tractar a tots per igual. Aquestes parades per perfil ètnic les fan per tancar a persones a CIEs i deportar-les del país.</p>",[],[],False,[],,2,0,0,False,True,1194719193486282752,"[{'screen_name': 'cescwilko', 'user_id': '324891857'}, {'screen_name': 'Misshapen77', 'user_id': '1139778452'}]"
462,cescwilko,CESC★,324891857,1195005088709910529,/cescwilko/status/1195005088709910529,2019-11-14 15:46:29,1573746389,"Estem parlant d’identificar...no acusar d’un delicte pel color que tens de pell. Jo he viscut en un país estranger on em tocava a mi passar pels controla aleatoris, i era cada vegada que entraba i sortia de l’aeroport. Era racisme? No...","<p class=""TweetTextSize js-tweet-text tweet-text"" data-aria-label-part=""0"" lang=""ca"">Estem parlant d’identificar...no acusar d’un <strong>delicte</strong> pel color que tens de pell. Jo he viscut en un país estranger on em tocava a mi passar pels controla aleatoris, i era cada vegada que entraba i sortia de l’aeroport. Era racisme? No...</p>",[],[],False,[],,0,0,3,True,True,1194719193486282752,"[{'screen_name': 'decibelsbels', 'user_id': '273314011'}, {'screen_name': 'Misshapen77', 'user_id': '1139778452'}]"
463,whohavethepower,who have the power?,2482730222,1195000411142414341,/whohavethepower/status/1195000411142414341,2019-11-14 15:27:54,1573745274,"Totalment d'acord, però sembla que els hi interessi que hi hagi inseguretat als carrers...","<p class=""TweetTextSize js-tweet-text tweet-text"" data-aria-label-part=""0"" lang=""ca"">Totalment d'acord, però sembla que els hi interessi que hi hagi <strong>inseguretat</strong> als carrers...</p>",[],[],False,[],,1,0,1,True,True,1194897265141469184,"[{'screen_name': 'EsmeraldaGuiver', 'user_id': '1670786474'}, {'screen_name': 'eli19_beth', 'user_id': '895257024933527553'}]"
464,Mpinedaaviles,Manuel Pineda Aviles,3028216773,1194997876117692418,/Mpinedaaviles/status/1194997876117692418,2019-11-14 15:17:50,1573744670,"#todoesmentira13N Risto no se ve ninguna agresion ,pregunta a los manifestantes de Barcelona y te diran que es agresion,o todos moros o todos cristianos,ademas según le indican al reportero se lo habian dicho 10 veces","<p class=""TweetTextSize js-tweet-text tweet-text"" data-aria-label-part=""0"" lang=""es""><a class=""twitter-hashtag pretty-link js-nav"" data-query-source=""hashtag_click"" dir=""ltr"" href=""/hashtag/todoesmentira13N?src=hash""><s>#</s><b>todoesmentira13N</b></a> Risto no se ve ninguna <strong>agresion</strong> ,pregunta a los manifestantes de <strong>Barcelona</strong> y te diran que es <strong>agresion</strong>,o todos moros o todos cristianos,ademas según le indican al reportero se lo habian dicho 10 veces</p>",[],['todoesmentira13N'],False,[],,0,0,0,False,False,,[]
465,viveyprogresa,irene,938522526795386882,1194995550397063170,/viveyprogresa/status/1194995550397063170,2019-11-14 15:08:35,1573744115,"Esa señora antisistema no tendría k vivir a costa del sistema. Y además se tendría k cuidar del orden en si ciudad Barcelona, desatada en violencia de los suyos, los antisistema.","<p class=""TweetTextSize js-tweet-text tweet-text"" data-aria-label-part=""0"" lang=""es"">Esa señora antisistema no tendría k vivir a costa del sistema. Y además se tendría k cuidar del orden en si ciudad <strong>Barcelona</strong>, desatada en <strong>violencia</strong> de los suyos, los antisistema.</p>",[],[],False,[],,3,1,0,False,True,1194952624799395842,"[{'screen_name': 'GuajeSalvaje', 'user_id': '918490448632664064'}]"
466,Newtral,Newtral,912745614823317504,1194993899162537986,/Newtral/status/1194993899162537986,2019-11-14 15:02:02,1573743722,"Este vídeo sigue circulando, asegurando que recoge la agresión a dos guardias civiles en las inmediaciones del Camp Nou en Barcelona. Es FALSO que sea así. Las imágenes pertenecen a las protestas en Chile.

http://bit.ly/2KnFyaj pic.twitter.com/afEGdKwp2O","<p class=""TweetTextSize js-tweet-text tweet-text"" data-aria-label-part=""0"" lang=""es"">Este vídeo sigue circulando, asegurando que recoge la <strong>agresión</strong> a dos guardias civiles en las inmediaciones del Camp Nou en <strong>Barcelona</strong>. Es FALSO<img alt=""❌"" aria-label=""Emoji: Cruz"" class=""Emoji Emoji--forText"" draggable=""false"" src=""https://abs.twimg.com/emoji/v2/72x72/274c.png"" title=""Cruz""/><img alt=""❌"" aria-label=""Emoji: Cruz"" class=""Emoji Emoji--forText"" draggable=""false"" src=""https://abs.twimg.com/emoji/v2/72x72/274c.png"" title=""Cruz""/> que sea así. Las imágenes pertenecen a las protestas en Chile.

<a class=""twitter-timeline-link"" data-expanded-url=""http://bit.ly/2KnFyaj"" dir=""ltr"" href=""https://t.co/oCKlJPBlrs"" rel=""nofollow noopener"" target=""_blank"" title=""http://bit.ly/2KnFyaj""><span class=""tco-ellipsis""></span><span class=""invisible"">http://</span><span class=""js-display-url"">bit.ly/2KnFyaj</span><span class=""invisible""></span><span class=""tco-ellipsis""><span class=""invisible""> </span></span></a><a class=""twitter-timeline-link u-hidden"" data-pre-embedded=""true"" dir=""ltr"" href=""https://t.co/afEGdKwp2O"">pic.twitter.com/afEGdKwp2O</a></p>",['http://bit.ly/2KnFyaj'],[],True,['https://pbs.twimg.com/media/EJV4nkcXUAAgdic.jpg'],,6,9,3,True,False,,[]
467,JaviIbSa,Javier Ibáñez,2994425950,1194985658433056768,/JaviIbSa/status/1194985658433056768,2019-11-14 14:29:17,1573741757,Aquí el único que ha pedido ilegalizar partidos son los de VOX. La violencia en las calles ha conseguido grandes logros para la sociedad. Esta es una imagen de Barcelona cuando consiguieron la jornada laboral de 8h para toda España. pic.twitter.com/nVXLgcZicz,"<p class=""TweetTextSize js-tweet-text tweet-text"" data-aria-label-part=""0"" lang=""es"">Aquí el único que ha pedido ilegalizar partidos son los de VOX. La <strong>violencia</strong> en las calles ha conseguido grandes logros para la sociedad. Esta es una imagen de <strong>Barcelona</strong> cuando consiguieron la jornada laboral de 8h para toda España. <a class=""twitter-timeline-link u-hidden"" data-pre-embedded=""true"" dir=""ltr"" href=""https://t.co/nVXLgcZicz"">pic.twitter.com/nVXLgcZicz</a></p>",[],[],True,['https://pbs.twimg.com/media/EJVxH1WXkAwS7Lt.jpg'],,1,0,1,True,True,1194615301444374529,"[{'screen_name': 'Criissramosss', 'user_id': '994966686150340614'}, {'screen_name': 'pedrosanz96', 'user_id': '1166419722621128712'}]"
468,OlmojaimeOlmo,jaime olmo,398712480,1194983539973988352,/OlmojaimeOlmo/status/1194983539973988352,2019-11-14 14:20:52,1573741252,"Pues, tras un mes de violencia callejera e interrupciones de tráfico en Barcelona, yo creo que el partido ""hartos"" tendría mayoría absoluta.","<p class=""TweetTextSize js-tweet-text tweet-text"" data-aria-label-part=""0"" lang=""es"">Pues, tras un mes de <strong>violencia</strong> callejera e interrupciones de tráfico en <strong>Barcelona</strong>, yo creo que el partido ""hartos"" tendría mayoría absoluta.</p>",[],[],False,[],,0,0,0,False,False,,[]
469,cariascc,carlos  *X,207190186,1194979450787651584,/cariascc/status/1194979450787651584,2019-11-14 14:04:37,1573740277,"Ayer me persiguieron 8 furgonas de de @policia por Av Madrid en Barcelona, mi delito: cortar la Diagonal de forma pacífica pic.twitter.com/afMrqQfqdk","<p class=""TweetTextSize js-tweet-text tweet-text"" data-aria-label-part=""0"" lang=""es"">Ayer me persiguieron 8 furgonas de de <a class=""twitter-atreply pretty-link js-nav"" data-mentioned-user-id=""23791197"" dir=""ltr"" href=""/policia""><s>@</s><b>policia</b></a> por Av Madrid en <strong>Barcelona</strong>, mi <strong>delito</strong>: cortar la Diagonal de forma pacífica <a class=""twitter-timeline-link u-hidden"" data-pre-embedded=""true"" dir=""ltr"" href=""https://t.co/afMrqQfqdk"">pic.twitter.com/afMrqQfqdk</a></p>",[],[],True,['https://pbs.twimg.com/media/EJVraOhWwAEbO_Q.jpg'],,1,0,1,True,True,1194962461989855233,"[{'screen_name': 'Coral_Mtn', 'user_id': '298199668'}]"
470,MrHarleyx,Herr Eisenheim 🇺🇸🤘♠️,526844650,1194967567821086720,/MrHarleyx/status/1194967567821086720,2019-11-14 13:17:24,1573737444,"Ya le han vuelto a robar el violin al conde de Godó, hay mucha inseguridad en Barcelona","<p class=""TweetTextSize js-tweet-text tweet-text"" data-aria-label-part=""0"" lang=""es"">Ya le han vuelto a robar el violin al conde de Godó, hay mucha <strong>inseguridad</strong> en <strong>Barcelona</strong></p>",[],[],False,[],,2,0,0,False,True,1194966355776290821,"[{'screen_name': 'LaResistencia', 'user_id': '952129529782337536'}, {'screen_name': 'Premios_Ondas', 'user_id': '385919778'}]"
471,IbisabelB,IbisabelB,928237128177340416,1194965394919804929,/IbisabelB/status/1194965394919804929,2019-11-14 13:08:46,1573736926,"La extrema-derecha, sí que vienen a Barcelona a provocar violencia.
Los CDR, corta carreteras,  pacíficamente, el derecho a manifestarse molesta? No, las huelgas programadas cada verano seguridad del Prat, Renfe, taxistas, Aena, sólo en Barcelona? 
Dejar de crear catalanofòbia.","<p class=""TweetTextSize js-tweet-text tweet-text"" data-aria-label-part=""0"" lang=""es"">La extrema-derecha, sí que vienen a <strong>Barcelona</strong> a provocar <strong>violencia</strong>.
Los CDR, corta carreteras,  pacíficamente, el derecho a manifestarse molesta? No, las huelgas programadas cada verano seguridad del Prat, Renfe, taxistas, Aena, sólo en <strong>Barcelona</strong>? 
Dejar de crear catalanofòbia.</p>",[],[],False,[],,1,2,8,True,True,1194921464513871874,"[{'screen_name': 'JotaMSilvaA', 'user_id': '843529590'}, {'screen_name': 'aquitania_de', 'user_id': '1110897110650621953'}, {'screen_name': 'tsunami_dem', 'user_id': '1156932156737904640'}]"
472,IbisabelB,IbisabelB,928237128177340416,1194965394727067648,/IbisabelB/status/1194965394727067648,2019-11-14 13:08:46,1573736926,"La extrema-derecha, sí que vienen a Barcelona a provocar violencia.
Los CDR, corta carreteras,  pacíficamente, el derecho a manifestarse molesta? No, las huelgas programadas cada verano seguridad del Prat, Renfe, taxistas, Aena, sólo en Barcelona? 
Dejar de crear catalanofòbia.","<p class=""TweetTextSize js-tweet-text tweet-text"" data-aria-label-part=""0"" lang=""es"">La extrema-derecha, sí que vienen a <strong>Barcelona</strong> a provocar <strong>violencia</strong>.
Los CDR, corta carreteras,  pacíficamente, el derecho a manifestarse molesta? No, las huelgas programadas cada verano seguridad del Prat, Renfe, taxistas, Aena, sólo en <strong>Barcelona</strong>? 
Dejar de crear catalanofòbia.</p>",[],[],False,[],,0,0,0,False,True,1194921464513871874,"[{'screen_name': 'JotaMSilvaA', 'user_id': '843529590'}, {'screen_name': 'aquitania_de', 'user_id': '1110897110650621953'}, {'screen_name': 'tsunami_dem', 'user_id': '1156932156737904640'}]"
473,Worldma95402464,Worldman,1185544296524587008,1194965365459169281,/Worldma95402464/status/1194965365459169281,2019-11-14 13:08:39,1573736919,"Más preocupación tendría que haber con el estado de delincuencia y anarquía indepe actual de Barcelona, señora...","<p class=""TweetTextSize js-tweet-text tweet-text"" data-aria-label-part=""0"" lang=""es"">Más preocupación tendría que haber con el estado de <strong>delincuencia</strong> y anarquía indepe actual de <strong>Barcelona</strong>, señora...</p>",[],[],False,[],,3,0,0,False,True,1194952624799395842,"[{'screen_name': 'GuajeSalvaje', 'user_id': '918490448632664064'}]"
474,JuanRibas,Juan Ribas,25196950,1194965347784413184,/JuanRibas/status/1194965347784413184,2019-11-14 13:08:34,1573736914,Quart detingut per l'agressió ultra a un jove el mes passat a Barcelona https://www.ccma.cat/324/quart-detingut-per-lagressio-ultra-a-un-jove-el-mes-passat-a-barcelona/noticia/2963155/#.Xc1Rzy-GY4A.twitter …,"<p class=""TweetTextSize js-tweet-text tweet-text"" data-aria-label-part=""0"" lang=""ca"">Quart detingut per l'<strong>agressió</strong> ultra a un jove el mes passat a <strong>Barcelona</strong> <a class=""twitter-timeline-link u-hidden"" data-expanded-url=""https://www.ccma.cat/324/quart-detingut-per-lagressio-ultra-a-un-jove-el-mes-passat-a-barcelona/noticia/2963155/#.Xc1Rzy-GY4A.twitter"" dir=""ltr"" href=""https://t.co/08j7DRByTM"" rel=""nofollow noopener"" target=""_blank"" title=""https://www.ccma.cat/324/quart-detingut-per-lagressio-ultra-a-un-jove-el-mes-passat-a-barcelona/noticia/2963155/#.Xc1Rzy-GY4A.twitter""><span class=""tco-ellipsis""></span><span class=""invisible"">https://www.</span><span class=""js-display-url"">ccma.cat/324/quart-deti</span><span class=""invisible"">ngut-per-lagressio-ultra-a-un-jove-el-mes-passat-a-barcelona/noticia/2963155/#.Xc1Rzy-GY4A.twitter</span><span class=""tco-ellipsis""><span class=""invisible""> </span>…</span></a></p>",['https://www.ccma.cat/324/quart-detingut-per-lagressio-ultra-a-un-jove-el-mes-passat-a-barcelona/noticia/2963155/#.Xc1Rzy-GY4A.twitter'],[],False,[],,0,0,0,False,False,,[]
