,screen_name,username,user_id,tweet_id,tweet_url,timestamp,timestamp_epochs,text,text_html,links,hashtags,has_media,img_urls,video_url,likes,retweets,replies,is_replied,is_reply_to,parent_tweet_id,reply_to_users
127,ServeiCivilCat,SCI Catalunya,197356782,1064954197400055809,/ServeiCivilCat/status/1064954197400055809,2018-11-20 18:50:41,1542739841,"Mariana Olisa del Col·lectiu #Afrofeminista de Barcelona analitza la violència simbòlica i els discursos racistas en la publicitat i als mitjans de comunicació. 
Posa com exemple la manipulació mediàtica entorn a la venda ambulant i el @sindicatomanter. 

#ConflictologiaSCIpic.twitter.com/XePx8zdppL","<p class=""TweetTextSize js-tweet-text tweet-text"" data-aria-label-part=""0"" lang=""ca"">Mariana Olisa del Col·lectiu <a class=""twitter-hashtag pretty-link js-nav"" data-query-source=""hashtag_click"" dir=""ltr"" href=""/hashtag/Afrofeminista?src=hash""><s>#</s><b>Afrofeminista</b></a> de <strong>Barcelona</strong> analitza la <strong>violència</strong> simbòlica i els discursos racistas en la publicitat i als mitjans de comunicació. 
<img alt=""👀"" aria-label=""Emoji: Ojos"" class=""Emoji Emoji--forText"" draggable=""false"" src=""https://abs.twimg.com/emoji/v2/72x72/1f440.png"" title=""Ojos""/>Posa com exemple la manipulació mediàtica entorn a la venda ambulant i el <a class=""twitter-atreply pretty-link js-nav"" data-mentioned-user-id=""732163861974007808"" dir=""ltr"" href=""/sindicatomanter""><s>@</s><b>sindicatomanter</b></a>. 

<a class=""twitter-hashtag pretty-link js-nav"" data-query-source=""hashtag_click"" dir=""ltr"" href=""/hashtag/ConflictologiaSCI?src=hash""><s>#</s><b>ConflictologiaSCI</b></a><a class=""twitter-timeline-link u-hidden"" data-pre-embedded=""true"" dir=""ltr"" href=""https://t.co/XePx8zdppL"">pic.twitter.com/XePx8zdppL</a></p>",[],"['Afrofeminista', 'ConflictologiaSCIpic']",True,['https://pbs.twimg.com/media/Dsd6JcHWsAAJRl-.jpg'],,5,1,0,False,False,,[]
128,slaymultimedios,SlayMultimedios,110238310,1064950206154850304,/slaymultimedios/status/1064950206154850304,2018-11-20 18:34:49,1542738889,"Policías en el referéndum catalán afirman haber sido testigos de ""violencia y odio extremo"" - BARCELONA (Sputnik) — Agentes de la Policía Nacional desplegados en Cataluña durante el referéndum unilateral de autodeterminación del 1 ... http://bit.ly/2DOLabY ","<p class=""TweetTextSize js-tweet-text tweet-text"" data-aria-label-part=""0"" lang=""es"">Policías en el referéndum catalán afirman haber sido testigos de ""<strong>violencia</strong> y odio extremo"" - <strong>BARCELONA</strong> (Sputnik) — Agentes de la Policía Nacional desplegados en Cataluña durante el referéndum unilateral de autodeterminación del 1 ... <a class=""twitter-timeline-link"" data-expanded-url=""http://bit.ly/2DOLabY"" dir=""ltr"" href=""https://t.co/Nc0KJ4gJnV"" rel=""nofollow noopener"" target=""_blank"" title=""http://bit.ly/2DOLabY""><span class=""tco-ellipsis""></span><span class=""invisible"">http://</span><span class=""js-display-url"">bit.ly/2DOLabY</span><span class=""invisible""></span><span class=""tco-ellipsis""><span class=""invisible""> </span></span></a></p>",['http://bit.ly/2DOLabY'],[],False,[],,0,0,0,False,False,,[]
129,freskot,Freski,60301406,1064939536940236800,/freskot/status/1064939536940236800,2018-11-20 17:52:25,1542736345,"No he negat que hi hagi violència: els fets d'ahir en són un exemple, tristament. Nego que siguin salvatges i espero que tu també, si realment treballes amb menors no acompanyats.

Mai no m'he trobat 30 infants nascuts aquí que pateixin la mateixa pobresa que un grup d'aquests.","<p class=""TweetTextSize js-tweet-text tweet-text"" data-aria-label-part=""0"" lang=""ca"">No he negat que hi hagi <strong>violència</strong>: els fets d'ahir en són un exemple, tristament. Nego que siguin salvatges i espero que tu també, si realment treballes amb menors no acompanyats.

Mai no m'he trobat 30 infants nascuts aquí que pateixin la mateixa pobresa que un grup d'aquests.</p>",[],[],False,[],,0,0,2,True,True,1064630804960239622,"[{'screen_name': 'Voltil3', 'user_id': '886696187474128896'}, {'screen_name': 'pegopatan', 'user_id': '898297882738085888'}]"
130,Voltil3,Laura,886696187474128896,1064937753077526529,/Voltil3/status/1064937753077526529,2018-11-20 17:45:20,1542735920,"Epa!!! Freski sigues sincer. He treballat amb ells i sí hi ha violència. Mira t'explico una mica: violacions a  CRAE, hòsties a tort i a dret...noi que hi ha de tot. Però la.diferència és q aquests nois no els pots comparar amb un infant d'aquí en situació de pobresa.","<p class=""TweetTextSize js-tweet-text tweet-text"" data-aria-label-part=""0"" lang=""ca"">Epa!!! Freski sigues sincer. He treballat amb ells i sí hi ha <strong>violència</strong>. Mira t'explico una mica: violacions a  CRAE, hòsties a tort i a dret...noi que hi ha de tot. Però la.diferència és q aquests nois no els pots comparar amb un infant d'aquí en situació de pobresa.</p>",[],[],False,[],,1,0,1,True,True,1064630804960239622,"[{'screen_name': 'freskot', 'user_id': '60301406'}, {'screen_name': 'pegopatan', 'user_id': '898297882738085888'}]"
131,Owiskar,Owiskar ||*|| 🎗,426196617,1064926927197216773,/Owiskar/status/1064926927197216773,2018-11-20 17:02:19,1542733339,"Pero que dices que sufres tu,mentirosa? Que violencia de los separatistas? Que se crean los de fuera las mentiras que decís lo puedo entender. Pero tú? De Barcelona? Es increíble el daño que estáis haciendo.","<p class=""TweetTextSize js-tweet-text tweet-text"" data-aria-label-part=""0"" lang=""es"">Pero que dices que sufres tu,mentirosa? Que <strong>violencia</strong> de los separatistas? Que se crean los de fuera las mentiras que decís lo puedo entender. Pero tú? De <strong>Barcelona</strong>? Es increíble el daño que estáis haciendo.</p>",[],[],False,[],,0,0,0,False,True,1064650291344228354,"[{'screen_name': 'ReinaSonia', 'user_id': '193292900'}, {'screen_name': 'tasionite', 'user_id': '190968196'}, {'screen_name': 'AdelanteAND', 'user_id': '998650076519116801'}]"
132,fcastle1905,Castle,290797640,1064922491313889281,/fcastle1905/status/1064922491313889281,2018-11-20 16:44:41,1542732281,Mira vos que mala leche el CM del Barcelona. Impresionante la violencia que genero. pic.twitter.com/HUaeLoLrTO,"<p class=""TweetTextSize js-tweet-text tweet-text"" data-aria-label-part=""0"" lang=""es"">Mira vos que mala leche el CM del <strong>Barcelona</strong>. Impresionante la <strong>violencia</strong> que genero. <a class=""twitter-timeline-link u-hidden"" data-pre-embedded=""true"" dir=""ltr"" href=""https://t.co/HUaeLoLrTO"">pic.twitter.com/HUaeLoLrTO</a></p>",[],[],True,['https://pbs.twimg.com/media/DsddRh3WwAEc4gc.jpg'],,0,0,0,False,False,,[]
133,gastonzurlo19,G@57oN,237024427,1064912268348002305,/gastonzurlo19/status/1064912268348002305,2018-11-20 16:04:04,1542729844,Aca el Barcelona se suma a la violencia!! pic.twitter.com/whGF84MUGZ,"<p class=""TweetTextSize js-tweet-text tweet-text"" data-aria-label-part=""0"" lang=""es"">Aca el <strong>Barcelona</strong> se suma a la <strong>violencia</strong>!! <a class=""twitter-timeline-link u-hidden"" data-pre-embedded=""true"" dir=""ltr"" href=""https://t.co/whGF84MUGZ"">pic.twitter.com/whGF84MUGZ</a></p>",[],[],True,['https://pbs.twimg.com/media/DsdUDzwWkAASw1d.jpg'],,1,0,0,False,True,1064819710175395840,"[{'screen_name': 'juancortese', 'user_id': '239221988'}]"
134,scea_cat,SCEA,2340048158,1064908443746791424,/scea_cat/status/1064908443746791424,2018-11-20 15:48:52,1542728932,"Dones dempeus pel medi ambient: En el marc del Dia Internacional per a l’Eliminació de la Violència contra les Dones.
Diumenge 25 de novembre a les 11h a La Fàbrica del Sol
Passeig Salvat Papasseit, 1 (Barcelona) 
Més informació i inscripcions: https://bit.ly/2Q8xQF1 pic.twitter.com/yKIExE0DOw","<p class=""TweetTextSize js-tweet-text tweet-text"" data-aria-label-part=""0"" lang=""ca"">Dones dempeus pel medi ambient: En el marc del Dia Internacional per a l’Eliminació de la <strong>Violència</strong> contra les Dones.
<img alt=""🗓️"" aria-label=""Emoji: Calendario espiralado"" class=""Emoji Emoji--forText"" draggable=""false"" src=""https://abs.twimg.com/emoji/v2/72x72/1f5d3.png"" title=""Calendario espiralado""/>Diumenge 25 de novembre a les 11h a <img alt=""📍"" aria-label=""Emoji: Tachuela redonda"" class=""Emoji Emoji--forText"" draggable=""false"" src=""https://abs.twimg.com/emoji/v2/72x72/1f4cd.png"" title=""Tachuela redonda""/>La Fàbrica del Sol
Passeig Salvat Papasseit, 1 (<strong>Barcelona</strong>) 
<img alt=""📝"" aria-label=""Emoji: Memorándum"" class=""Emoji Emoji--forText"" draggable=""false"" src=""https://abs.twimg.com/emoji/v2/72x72/1f4dd.png"" title=""Memorándum""/>Més informació i inscripcions: <a class=""twitter-timeline-link"" data-expanded-url=""https://bit.ly/2Q8xQF1"" dir=""ltr"" href=""https://t.co/mRbpTcLhgZ"" rel=""nofollow noopener"" target=""_blank"" title=""https://bit.ly/2Q8xQF1""><span class=""tco-ellipsis""></span><span class=""invisible"">https://</span><span class=""js-display-url"">bit.ly/2Q8xQF1</span><span class=""invisible""></span><span class=""tco-ellipsis""><span class=""invisible""> </span></span></a><a class=""twitter-timeline-link u-hidden"" data-pre-embedded=""true"" dir=""ltr"" href=""https://t.co/yKIExE0DOw"">pic.twitter.com/yKIExE0DOw</a></p>",['https://bit.ly/2Q8xQF1'],[],True,['https://pbs.twimg.com/media/DsdPlctWwAEoX4_.jpg'],,10,3,0,False,False,,[]
135,usocatalunya,USOC,107130467,1064871652566147072,/usocatalunya/status/1064871652566147072,2018-11-20 13:22:40,1542720160,"25N Dia Internacional per l’eliminació de la violència envers les dones , organiza una jornada el dia 22 a les 10 h a Barcelona c/ Sant Pacià, 9 https://usoc.cat/25n-dia-internacional-per-leliminacio-de-la-violencia-envers-les-dones/ … #TreuteLaBena","<p class=""TweetTextSize js-tweet-text tweet-text"" data-aria-label-part=""0"" lang=""ca"">25N Dia Internacional per l’eliminació de la <strong>violència</strong> envers les dones , organiza una jornada el dia 22 a les 10 h a <strong>Barcelona</strong> c/ Sant Pacià, 9 <a class=""twitter-timeline-link"" data-expanded-url=""https://usoc.cat/25n-dia-internacional-per-leliminacio-de-la-violencia-envers-les-dones/"" dir=""ltr"" href=""https://t.co/5kMIlyQeAk"" rel=""nofollow noopener"" target=""_blank"" title=""https://usoc.cat/25n-dia-internacional-per-leliminacio-de-la-violencia-envers-les-dones/""><span class=""tco-ellipsis""></span><span class=""invisible"">https://</span><span class=""js-display-url"">usoc.cat/25n-dia-intern</span><span class=""invisible"">acional-per-leliminacio-de-la-violencia-envers-les-dones/</span><span class=""tco-ellipsis""><span class=""invisible""> </span>…</span></a> <a class=""twitter-hashtag pretty-link js-nav"" data-query-source=""hashtag_click"" dir=""ltr"" href=""/hashtag/TreuteLaBena?src=hash""><s>#</s><b>TreuteLaBena</b></a></p>",['https://usoc.cat/25n-dia-internacional-per-leliminacio-de-la-violencia-envers-les-dones/'],['TreuteLaBena'],False,[],,11,12,0,False,False,,[]
136,mareaverdebcn,Marea Verde Barcelona,1025743249850466304,1064869385511321601,/mareaverdebcn/status/1064869385511321601,2018-11-20 13:13:40,1542719620,"La prohibición del aborto es violencia, porque atenta contra la vida y la salud de los cuerpos gestantes. Por eso el  #25N saldremos a las calles de #Barcelona una vez más a exigir #AbortoLegal. Y tambien acompañaremos a las compañeras de #Andorra @caterinayvonaSVhttps://twitter.com/HuelgaFeminista/status/1064432804669329409 …","<p class=""TweetTextSize js-tweet-text tweet-text"" data-aria-label-part=""4"" lang=""es"">La prohibición del aborto es <strong>violencia</strong>, porque atenta contra la vida y la salud de los cuerpos gestantes. Por eso el  <a class=""twitter-hashtag pretty-link js-nav"" data-query-source=""hashtag_click"" dir=""ltr"" href=""/hashtag/25N?src=hash""><s>#</s><b>25N</b></a> saldremos a las calles de <a class=""twitter-hashtag pretty-link js-nav"" data-query-source=""hashtag_click"" dir=""ltr"" href=""/hashtag/Barcelona?src=hash""><s>#</s><b><strong>Barcelona</strong></b></a> una vez más a exigir <a class=""twitter-hashtag pretty-link js-nav"" data-query-source=""hashtag_click"" dir=""ltr"" href=""/hashtag/AbortoLegal?src=hash""><s>#</s><b>AbortoLegal</b></a>. Y tambien acompañaremos a las compañeras de <a class=""twitter-hashtag pretty-link js-nav"" data-query-source=""hashtag_click"" dir=""ltr"" href=""/hashtag/Andorra?src=hash""><s>#</s><b>Andorra</b></a> <a class=""twitter-atreply pretty-link js-nav"" data-mentioned-user-id=""1005020866571329537"" dir=""ltr"" href=""/caterinayvonaSV""><s>@</s><b>caterinayvonaSV</b></a><a class=""twitter-timeline-link u-hidden"" data-expanded-url=""https://twitter.com/HuelgaFeminista/status/1064432804669329409"" dir=""ltr"" href=""https://t.co/PjvDWYcz3C"" rel=""nofollow noopener"" target=""_blank"" title=""https://twitter.com/HuelgaFeminista/status/1064432804669329409""><span class=""tco-ellipsis""></span><span class=""invisible"">https://</span><span class=""js-display-url"">twitter.com/HuelgaFeminist</span><span class=""invisible"">a/status/1064432804669329409</span><span class=""tco-ellipsis""><span class=""invisible""> </span>…</span></a></p>",['https://twitter.com/HuelgaFeminista/status/1064432804669329409'],"['25N', 'Barcelona', 'AbortoLegal', 'Andorra']",False,[],,13,8,2,True,False,,[]
137,AytoAviles,AytoAvilés,505726317,1064860993652736001,/AytoAviles/status/1064860993652736001,2018-11-20 12:40:19,1542717619,"Visita guiada por la exposición ""Muñecas"" de Sergio Sabini como parte de los actos del 25N. El autor muestra la violencia de género mediante fotografías de muñecas tomadas en el mercado de objetos de segunda mano ""Els Encants"" de Barcelona acompañadas de textos y noticias. pic.twitter.com/5qdvi7QoQ0","<p class=""TweetTextSize js-tweet-text tweet-text"" data-aria-label-part=""0"" lang=""es"">Visita guiada por la exposición ""Muñecas"" de Sergio Sabini como parte de los actos del 25N. El autor muestra la <strong>violencia</strong> de género mediante fotografías de muñecas tomadas en el mercado de objetos de segunda mano ""Els Encants"" de <strong>Barcelona</strong> acompañadas de textos y noticias. <a class=""twitter-timeline-link u-hidden"" data-pre-embedded=""true"" dir=""ltr"" href=""https://t.co/5qdvi7QoQ0"">pic.twitter.com/5qdvi7QoQ0</a></p>",[],[],True,"['https://pbs.twimg.com/media/DsckYswWkAA4Pu8.jpg', 'https://pbs.twimg.com/media/Dscke9YXcAAbOrx.jpg', 'https://pbs.twimg.com/media/Dsckh9AW0AAOXXN.jpg', 'https://pbs.twimg.com/media/DsckjlBXgAIGOpa.jpg']",,4,1,0,False,False,,[]
138,luisfergegea,Luisfer García Egea,473173755,1064994442740932608,/luisfergegea/status/1064994442740932608,2018-11-20 21:30:36,1542749436,".@jaumecollboni @nucarmonac @pscbarcelona @PSC_HG Amb veïns, restauradors i esportistes de la #Teixonera #hg7 #Barcelona abordant els problemes del barri: inseguretat, brutícia, falta de manteniment i inversions, abandonament #Taxonera #barriabarripic.twitter.com/NfvWoHtaPf","<p class=""TweetTextSize js-tweet-text tweet-text"" data-aria-label-part=""0"" lang=""ca"">.<a class=""twitter-atreply pretty-link js-nav"" data-mentioned-user-id=""16200585"" dir=""ltr"" href=""/jaumecollboni""><s>@</s><b>jaumecollboni</b></a> <a class=""twitter-atreply pretty-link js-nav"" data-mentioned-user-id=""4828210601"" dir=""ltr"" href=""/nucarmonac""><s>@</s><b>nucarmonac</b></a> <a class=""twitter-atreply pretty-link js-nav"" data-mentioned-user-id=""510203470"" dir=""ltr"" href=""/pscbarcelona""><s>@</s><b>pscbarcelona</b></a> <a class=""twitter-atreply pretty-link js-nav"" data-mentioned-user-id=""594728994"" dir=""ltr"" href=""/PSC_HG""><s>@</s><b>PSC_HG</b></a> Amb veïns, restauradors i esportistes de la <a class=""twitter-hashtag pretty-link js-nav"" data-query-source=""hashtag_click"" dir=""ltr"" href=""/hashtag/Teixonera?src=hash""><s>#</s><b>Teixonera</b></a> <a class=""twitter-hashtag pretty-link js-nav"" data-query-source=""hashtag_click"" dir=""ltr"" href=""/hashtag/hg7?src=hash""><s>#</s><b>hg7</b></a> <a class=""twitter-hashtag pretty-link js-nav"" data-query-source=""hashtag_click"" dir=""ltr"" href=""/hashtag/Barcelona?src=hash""><s>#</s><b><strong>Barcelona</strong></b></a> abordant els problemes del barri: <strong>inseguretat</strong>, brutícia, falta de manteniment i inversions, abandonament <a class=""twitter-hashtag pretty-link js-nav"" data-query-source=""hashtag_click"" dir=""ltr"" href=""/hashtag/Taxonera?src=hash""><s>#</s><b>Taxonera</b></a> <a class=""twitter-hashtag pretty-link js-nav"" data-query-source=""hashtag_click"" dir=""ltr"" href=""/hashtag/barriabarri?src=hash""><s>#</s><b>barriabarri</b></a><a class=""twitter-timeline-link u-hidden"" data-pre-embedded=""true"" dir=""ltr"" href=""https://t.co/NfvWoHtaPf"">pic.twitter.com/NfvWoHtaPf</a></p>",[],"['Teixonera', 'hg7', 'Barcelona', 'Taxonera', 'barriabarripic']",True,['https://pbs.twimg.com/media/DseeytFX4AEZRYP.jpg'],,6,2,0,False,False,,[]
139,NoEsPotCat,Catalunya en Comú NO Podem,755884774443642880,1064991396967387141,/NoEsPotCat/status/1064991396967387141,2018-11-20 21:18:30,1542748710,"La culpa dels desnonaments a Barcelona és d'en Trias.
I també l'augment del 20% de la delinqüència a la ciutat. I dels narcopisos al Raval. També del NO tancament del CIE. I de l'endollament massiu a l'Ajuntament de familiars, amics o parelles... #NOESPOThttps://twitter.com/galapita/status/1064945003464675328?s=19 …","<p class=""TweetTextSize js-tweet-text tweet-text"" data-aria-label-part=""4"" lang=""ca"">La culpa dels desnonaments a <strong>Barcelona</strong> és d'en Trias.
I també l'augment del 20% de la <strong>delinqüència</strong> a la ciutat. I dels narcopisos al Raval. També del NO tancament del CIE. I de l'endollament massiu a l'Ajuntament de familiars, amics o parelles... <a class=""twitter-hashtag pretty-link js-nav"" data-query-source=""hashtag_click"" dir=""ltr"" href=""/hashtag/NOESPOT?src=hash""><s>#</s><b>NOESPOT</b></a><a class=""twitter-timeline-link u-hidden"" data-expanded-url=""https://twitter.com/galapita/status/1064945003464675328?s=19"" dir=""ltr"" href=""https://t.co/GB2A94QFsK"" rel=""nofollow noopener"" target=""_blank"" title=""https://twitter.com/galapita/status/1064945003464675328?s=19""><span class=""tco-ellipsis""></span><span class=""invisible"">https://</span><span class=""js-display-url"">twitter.com/galapita/statu</span><span class=""invisible"">s/1064945003464675328?s=19</span><span class=""tco-ellipsis""><span class=""invisible""> </span>…</span></a></p>",['https://twitter.com/galapita/status/1064945003464675328?s=19'],['NOESPOThttps'],False,[],,14,9,0,False,False,,[]
140,BCN_Dones,Barcelona Dones,2412893305,1064971897413279744,/BCN_Dones/status/1064971897413279744,2018-11-20 20:01:01,1542744061,"Has patit una agressió sexual? 
El Servei d'Urgències de l'Hospital  Clínic de Barcelona té un equip de professionals de la medicina, de la  infermeria i del treball social per assistir-te.
 932 275 400
 Carrer de Villarroel, 170
 http://ajuntament.barcelona.cat/bcnantimasclista/ca/serveis-datencio …
#BCNantimasclistapic.twitter.com/xXmvuqnFWs","<p class=""TweetTextSize js-tweet-text tweet-text"" data-aria-label-part=""0"" lang=""ca"">Has patit una <strong>agressió</strong> sexual? 
El Servei d'Urgències de l'Hospital  Clínic de <strong>Barcelona</strong> té un equip de professionals de la medicina, de la  infermeria i del treball social per assistir-te.
<img alt=""📞"" aria-label=""Emoji: Auricular de teléfono"" class=""Emoji Emoji--forText"" draggable=""false"" src=""https://abs.twimg.com/emoji/v2/72x72/1f4de.png"" title=""Auricular de teléfono""/> 932 275 400
<img alt=""📍"" aria-label=""Emoji: Tachuela redonda"" class=""Emoji Emoji--forText"" draggable=""false"" src=""https://abs.twimg.com/emoji/v2/72x72/1f4cd.png"" title=""Tachuela redonda""/> Carrer de Villarroel, 170
<img alt=""👉"" aria-label=""Emoji: Dorso de la mano con el dedo índice señalando hacia la derecha"" class=""Emoji Emoji--forText"" draggable=""false"" src=""https://abs.twimg.com/emoji/v2/72x72/1f449.png"" title=""Dorso de la mano con el dedo índice señalando hacia la derecha""/> <a class=""twitter-timeline-link"" data-expanded-url=""http://ajuntament.barcelona.cat/bcnantimasclista/ca/serveis-datencio"" dir=""ltr"" href=""https://t.co/iMuEPIVl9j"" rel=""nofollow noopener"" target=""_blank"" title=""http://ajuntament.barcelona.cat/bcnantimasclista/ca/serveis-datencio""><span class=""tco-ellipsis""></span><span class=""invisible"">http://</span><span class=""js-display-url"">ajuntament.barcelona.cat/bcnantimasclis</span><span class=""invisible"">ta/ca/serveis-datencio</span><span class=""tco-ellipsis""><span class=""invisible""> </span>…</span></a>
<a class=""twitter-hashtag pretty-link js-nav"" data-query-source=""hashtag_click"" dir=""ltr"" href=""/hashtag/BCNantimasclista?src=hash""><s>#</s><b>BCNantimasclista</b></a><a class=""twitter-timeline-link u-hidden"" data-pre-embedded=""true"" dir=""ltr"" href=""https://t.co/xXmvuqnFWs"">pic.twitter.com/xXmvuqnFWs</a></p>",['http://ajuntament.barcelona.cat/bcnantimasclista/ca/serveis-datencio'],['BCNantimasclistapic'],True,['https://pbs.twimg.com/media/DseKS5cXoAE80HD.jpg'],,2,4,0,False,False,,[]
141,kokecabrera,Koke Cabrera 🎨🕺🏋️💪😎🤜,199888321,1064967071358955521,/kokecabrera/status/1064967071358955521,2018-11-20 19:41:50,1542742910,"Ésto es lo que deja la gran alcaldesa @AdaColau en Barcelona, más delincuencia y más violencia.
Peor no se puede hacer.
#LaSilenciosaCat","<p class=""TweetTextSize js-tweet-text tweet-text"" data-aria-label-part=""0"" lang=""es"">Ésto es lo que deja la gran alcaldesa <a class=""twitter-atreply pretty-link js-nav"" data-mentioned-user-id=""102095809"" dir=""ltr"" href=""/AdaColau""><s>@</s><b>AdaColau</b></a> en <strong>Barcelona</strong>, más <strong>delincuencia</strong> y más <strong>violencia</strong>.
Peor no se puede hacer.
<a class=""twitter-hashtag pretty-link js-nav"" data-query-source=""hashtag_click"" dir=""ltr"" href=""/hashtag/LaSilenciosaCat?src=hash""><s>#</s><b>LaSilenciosaCat</b></a></p>",[],['LaSilenciosaCat'],False,[],,0,0,0,False,True,1064877554715303936,"[{'screen_name': 'Runnermachacon', 'user_id': '856576779871539201'}]"
142,OnysReynols,OnysReynols,588977117,1064962960681037824,/OnysReynols/status/1064962960681037824,2018-11-20 19:25:30,1542741930,"La derecha cada vez que a gobernado, ha tenido que arreglar la ruina que les deja la izquierda. Lo peligroso es que gobiernen ellos, véase Madrid, Barcelona las están convirtiendo en ciudades llenas de delincuencia, basura e impuestos hasta por respirar https://twitter.com/carmelojorda/status/1064495992140169216 …","<p class=""TweetTextSize js-tweet-text tweet-text"" data-aria-label-part=""4"" lang=""es"">La derecha cada vez que a gobernado, ha tenido que arreglar la ruina que les deja la izquierda. Lo peligroso es que gobiernen ellos, véase Madrid, <strong>Barcelona</strong> las están convirtiendo en ciudades llenas de <strong>delincuencia</strong>, basura e impuestos hasta por respirar <a class=""twitter-timeline-link u-hidden"" data-expanded-url=""https://twitter.com/carmelojorda/status/1064495992140169216"" dir=""ltr"" href=""https://t.co/YCEG3Xbajr"" rel=""nofollow noopener"" target=""_blank"" title=""https://twitter.com/carmelojorda/status/1064495992140169216""><span class=""tco-ellipsis""></span><span class=""invisible"">https://</span><span class=""js-display-url"">twitter.com/carmelojorda/s</span><span class=""invisible"">tatus/1064495992140169216</span><span class=""tco-ellipsis""><span class=""invisible""> </span>…</span></a></p>",['https://twitter.com/carmelojorda/status/1064495992140169216'],[],False,[],,0,0,0,False,False,,[]
143,jaanillo,Juan Antonio Anillo González ⚓,708355537277198336,1064958234266611713,/jaanillo/status/1064958234266611713,2018-11-20 19:06:43,1542740803,"Me encanta la entrada en Wikipedia para Leticia Dolera: 
Leticia Dolera (Barcelona, 23 de octubre de 1981) es una actriz y directora española ""comprometida"" con la defensa de los derechos de las mujeres y la lucha contra la violencia de género.

Oportuno entrecomillado.","<p class=""TweetTextSize js-tweet-text tweet-text"" data-aria-label-part=""0"" lang=""es"">Me encanta la entrada en Wikipedia para Leticia Dolera: 
Leticia Dolera (<strong>Barcelona</strong>, 23 de octubre de 1981) es una actriz y directora española ""comprometida"" con la defensa de los derechos de las mujeres y la lucha contra la <strong>violencia</strong> de género.

Oportuno entrecomillado.</p>",[],[],False,[],,1,0,0,False,False,,[]
