,screen_name,username,user_id,tweet_id,tweet_url,timestamp,timestamp_epochs,text,text_html,links,hashtags,has_media,img_urls,video_url,likes,retweets,replies,is_replied,is_reply_to,parent_tweet_id,reply_to_users
426,23Solzhenitsyn,Cristina,849207019848519680,1144352590035075072,/23Solzhenitsyn/status/1144352590035075072,2019-06-27 21:11:33,1561669893,"Detroit 1950 - 2019
White flight, los blancos y ricos abandonaron la ciudad ante la creciente inseguridad y violencia. Al poco tiempo las clases medias abandonaron las afueras por la misma razón y finalmente la ciudad quedó abandonada.

Barcelona va x ese camino. pic.twitter.com/8NtgdxaIEF","<p class=""TweetTextSize js-tweet-text tweet-text"" data-aria-label-part=""0"" lang=""es"">Detroit 1950 - 2019
White flight, los blancos y ricos abandonaron la ciudad ante la creciente <strong>inseguridad</strong> y <strong>violencia</strong>. Al poco tiempo las clases medias abandonaron las afueras por la misma razón y finalmente la ciudad quedó abandonada.

<strong>Barcelona</strong> va x ese camino. <a class=""twitter-timeline-link u-hidden"" data-pre-embedded=""true"" dir=""ltr"" href=""https://t.co/8NtgdxaIEF"">pic.twitter.com/8NtgdxaIEF</a></p>",[],[],True,"['https://pbs.twimg.com/media/D-GOmP8WsAESHHH.jpg', 'https://pbs.twimg.com/media/D-GOm_kX4AAcxoA.jpg']",,3,1,1,True,True,1144276235981348865,"[{'screen_name': 'crpandemonium', 'user_id': '4229241075'}]"
427,Isaac__am,Isaac,943077029624328192,1144350823004196864,/Isaac__am/status/1144350823004196864,2019-06-27 21:04:31,1561669471,Convivencia? Será delincuencia. De nada sirve convivir si después de saludar al quiosquero te abren la cabeza contra el suelo pq te han robado.,"<p class=""TweetTextSize js-tweet-text tweet-text"" data-aria-label-part=""0"" lang=""es"">Convivencia? Será <strong>delincuencia</strong>. De nada sirve convivir si después de saludar al quiosquero te abren la cabeza contra el suelo pq te han robado.</p>",[],[],False,[],,3,0,0,False,True,1144291063571652608,"[{'screen_name': 'AdaColau', 'user_id': '102095809'}, {'screen_name': 'barcelona_GUB', 'user_id': '442728468'}]"
428,CensuratNews,Censurat News 🔻,835125421817593859,1144350195762835460,/CensuratNews/status/1144350195762835460,2019-06-27 21:02:02,1561669322,"Adrià Alemany, parella d’Ada Colau, fent ‘like’ als “arguments” de la Fallarás banalitzant la inseguretat a Barcelona. 

Ja sabeu qui serà la propera endollada a l’Ajuntament. https://twitter.com/LaFallaras/status/1144341456305500162 …pic.twitter.com/CyTToyJjOX","<p class=""TweetTextSize js-tweet-text tweet-text"" data-aria-label-part=""0"" lang=""ca"">Adrià Alemany, parella d’Ada Colau, fent ‘like’ als “arguments” de la Fallarás banalitzant la <strong>inseguretat</strong> a <strong>Barcelona</strong>. 

Ja sabeu qui serà la propera endollada a l’Ajuntament. <a class=""twitter-timeline-link"" data-expanded-url=""https://twitter.com/LaFallaras/status/1144341456305500162"" dir=""ltr"" href=""https://t.co/V8Hdqzn3IP"" rel=""nofollow noopener"" target=""_blank"" title=""https://twitter.com/LaFallaras/status/1144341456305500162""><span class=""tco-ellipsis""></span><span class=""invisible"">https://</span><span class=""js-display-url"">twitter.com/LaFallaras/sta</span><span class=""invisible"">tus/1144341456305500162</span><span class=""tco-ellipsis""><span class=""invisible""> </span>…</span></a><a class=""twitter-timeline-link u-hidden"" data-pre-embedded=""true"" dir=""ltr"" href=""https://t.co/CyTToyJjOX"">pic.twitter.com/CyTToyJjOX</a></p>",['https://twitter.com/LaFallaras/status/1144341456305500162'],[],True,['https://pbs.twimg.com/media/D-GMbwLXUAEvVH_.jpg'],,21,15,4,True,False,,[]
429,Lostin_Palma,Sr Lostin,557999626,1144347456060239879,/Lostin_Palma/status/1144347456060239879,2019-06-27 20:51:09,1561668669,"La ciudad con mayor índice de delincuencia del país repite alcaldesa. Barcelona va a terminar como Gotham City con la salvedad de que, en vez de a Batman Barcelona solo dispone de usted con su uniforme verde antidesahucios. pic.twitter.com/qmWnZc3wRQ","<p class=""TweetTextSize js-tweet-text tweet-text"" data-aria-label-part=""0"" lang=""es"">La ciudad con mayor índice de <strong>delincuencia</strong> del país repite alcaldesa. <strong>Barcelona</strong> va a terminar como Gotham City con la salvedad de que, en vez de a Batman <strong>Barcelona</strong> solo dispone de usted con su uniforme verde antidesahucios. <a class=""twitter-timeline-link u-hidden"" data-pre-embedded=""true"" dir=""ltr"" href=""https://t.co/qmWnZc3wRQ"">pic.twitter.com/qmWnZc3wRQ</a></p>",[],[],True,['https://pbs.twimg.com/media/D-GJ8YdX4AEcnXT.jpg'],,3,0,1,True,True,1144316407443861506,"[{'screen_name': 'AdaColau', 'user_id': '102095809'}, {'screen_name': 'bcn_ajuntament', 'user_id': '423369901'}]"
430,Jordi420000381,@Jordi42000038,948633819220987905,1144346709222416385,/Jordi420000381/status/1144346709222416385,2019-06-27 20:48:11,1561668491,Despres es posa a plorar a la TV... Es indignant... Ja tenim un Mort per la inseguretat del día a día a la ciutat sense llei... Barcelona.. Quina pena..,"<p class=""TweetTextSize js-tweet-text tweet-text"" data-aria-label-part=""0"" lang=""es"">Despres es posa a plorar a la TV... Es indignant... Ja tenim un Mort per la <strong>inseguretat</strong> del día a día a la ciutat sense llei... <strong>Barcelona</strong>.. Quina pena..</p>",[],[],False,[],,0,0,0,False,True,1144316407443861506,"[{'screen_name': 'AdaColau', 'user_id': '102095809'}, {'screen_name': 'bcn_ajuntament', 'user_id': '423369901'}]"
431,daniferfab,Ibéricas Maneras 🇪🇸,228502841,1144346683842736139,/daniferfab/status/1144346683842736139,2019-06-27 20:48:05,1561668485,"Cientos de menas llenan nuestras calles de delincuencia. Y nadie hace nada, no piensen que somos racistas. 

Fallece la alto cargo de Corea del Sur ingresada tras sufrir un atraco en Barcelona https://www.elmundo.es/cataluna/2019/06/27/5d14e3fafc6c8336728b45b5.html …","<p class=""TweetTextSize js-tweet-text tweet-text"" data-aria-label-part=""0"" lang=""es"">Cientos de menas llenan nuestras calles de <strong>delincuencia</strong>. Y nadie hace nada, no piensen que somos racistas. 

Fallece la alto cargo de Corea del Sur ingresada tras sufrir un atraco en <strong>Barcelona</strong> <a class=""twitter-timeline-link u-hidden"" data-expanded-url=""https://www.elmundo.es/cataluna/2019/06/27/5d14e3fafc6c8336728b45b5.html"" dir=""ltr"" href=""https://t.co/kCS0zvVjNe"" rel=""nofollow noopener"" target=""_blank"" title=""https://www.elmundo.es/cataluna/2019/06/27/5d14e3fafc6c8336728b45b5.html""><span class=""tco-ellipsis""></span><span class=""invisible"">https://www.</span><span class=""js-display-url"">elmundo.es/cataluna/2019/</span><span class=""invisible"">06/27/5d14e3fafc6c8336728b45b5.html</span><span class=""tco-ellipsis""><span class=""invisible""> </span>…</span></a></p>",['https://www.elmundo.es/cataluna/2019/06/27/5d14e3fafc6c8336728b45b5.html'],[],False,[],,0,0,0,False,False,,[]
432,Michahel78,L'Esmolet puntCAT 🎗 🏴,1018498743560261637,1144345869166293001,/Michahel78/status/1144345869166293001,2019-06-27 20:44:50,1561668290,Gràcies a vostè (i als alcaldes sociates que la van precedir) la inseguretat a Barcelona ja ha arribat gairebé al nivell de crear conflictes internacionals. La Republica es mereix una capital molt millor.,"<p class=""TweetTextSize js-tweet-text tweet-text"" data-aria-label-part=""0"" lang=""ca"">Gràcies a vostè (i als alcaldes sociates que la van precedir) la <strong>inseguretat</strong> a <strong>Barcelona</strong> ja ha arribat gairebé al nivell de crear conflictes internacionals. La Republica es mereix una capital molt millor.</p>",[],[],False,[],,8,1,0,False,True,1144316407443861506,"[{'screen_name': 'AdaColau', 'user_id': '102095809'}, {'screen_name': 'bcn_ajuntament', 'user_id': '423369901'}]"
433,catala12345,Lleidatà,931999333762945024,1144343575276269570,/catala12345/status/1144343575276269570,2019-06-27 20:35:43,1561667743,Líderes en inseguridad ciudadana. Como está quedando Barcelona con este gobierno,"<p class=""TweetTextSize js-tweet-text tweet-text"" data-aria-label-part=""0"" lang=""es"">Líderes en <strong>inseguridad</strong> ciudadana. Como está quedando <strong>Barcelona</strong> con este gobierno</p>",[],[],False,[],,2,2,0,False,True,1144316407443861506,"[{'screen_name': 'AdaColau', 'user_id': '102095809'}, {'screen_name': 'bcn_ajuntament', 'user_id': '423369901'}]"
434,claretjordi,jordi claret piquero,245892528,1144342773652439040,/claretjordi/status/1144342773652439040,2019-06-27 20:32:32,1561667552,Pues que vuelvan los tironeros y provoquen una muerte si que es inseguridad.Y vamos camino a volver a los 80 en este tema(hasta vuelve la heroina) y tb conoci es barcelona,"<p class=""TweetTextSize js-tweet-text tweet-text"" data-aria-label-part=""0"" lang=""es"">Pues que vuelvan los tironeros y provoquen una muerte si que es <strong>inseguridad</strong>.Y vamos camino a volver a los 80 en este tema(hasta vuelve la heroina) y tb conoci es <strong>barcelona</strong></p>",[],[],False,[],,4,0,2,True,True,1144316407443861506,"[{'screen_name': 'LaFallaras', 'user_id': '2913936040'}, {'screen_name': 'ragnampaisser', 'user_id': '418215161'}]"
435,GraciaVox,Vox Gracia,1110933937633792002,1144341764058353664,/GraciaVox/status/1144341764058353664,2019-06-27 20:28:32,1561667312,Haber convertido durante tu mandato a Barcelona en la ciudad con mas delincuencia de España no te hace reflexionar? No hablemos ya de pedir perdón.... Por no hablar de la cantidad de horas que te ha costado escribir este simple tweet... Tipicas lágrimas de cocodrilo falsarias,"<p class=""TweetTextSize js-tweet-text tweet-text"" data-aria-label-part=""0"" lang=""es"">Haber convertido durante tu mandato a <strong>Barcelona</strong> en la ciudad con mas <strong>delincuencia</strong> de España no te hace reflexionar? No hablemos ya de pedir perdón.... Por no hablar de la cantidad de horas que te ha costado escribir este simple tweet... Tipicas lágrimas de cocodrilo falsarias</p>",[],[],False,[],,2,1,0,False,True,1144316407443861506,"[{'screen_name': 'AdaColau', 'user_id': '102095809'}, {'screen_name': 'bcn_ajuntament', 'user_id': '423369901'}]"
436,JoanFCat,Joan,1390792051,1144338261562843138,/JoanFCat/status/1144338261562843138,2019-06-27 20:14:36,1561666476,"Mentre les víctimes de la delinqüència a Barcelona eren catalanes o turistes d'a peu, per què no escrivies aquest tuit?

Tan poc respecte et mereixem?

Tan poca consideració ens tens?","<p class=""TweetTextSize js-tweet-text tweet-text"" data-aria-label-part=""0"" lang=""ca"">Mentre les víctimes de la <strong>delinqüència</strong> a <strong>Barcelona</strong> eren catalanes o turistes d'a peu, per què no escrivies aquest tuit?

Tan poc respecte et mereixem?

Tan poca consideració ens tens?</p>",[],[],False,[],,0,0,1,True,True,1144306323716227074,"[{'screen_name': 'jccalbet', 'user_id': '169436054'}]"
437,Jim08583120,Jim,1010974011868753922,1144337740273782784,/Jim08583120/status/1144337740273782784,2019-06-27 20:12:32,1561666352,Muere la alto cargo de Corea del Sur que sufrió un robo con violencia en Barcelona https://www.20minutos.es/noticia/3685846/0/muere-la-alto-cargo-coreana-que-sufrio-un-robo-con-violencia-en-barcelona/?utm_source=twitter.com&utm_medium=socialshare&utm_campaign=mobile_web … a través de @20m,"<p class=""TweetTextSize js-tweet-text tweet-text"" data-aria-label-part=""0"" lang=""es"">Muere la alto cargo de Corea del Sur que sufrió un robo con <strong>violencia</strong> en <strong>Barcelona</strong> <a class=""twitter-timeline-link"" data-expanded-url=""https://www.20minutos.es/noticia/3685846/0/muere-la-alto-cargo-coreana-que-sufrio-un-robo-con-violencia-en-barcelona/?utm_source=twitter.com&amp;utm_medium=socialshare&amp;utm_campaign=mobile_web"" dir=""ltr"" href=""https://t.co/7hfUxqWeTf"" rel=""nofollow noopener"" target=""_blank"" title=""https://www.20minutos.es/noticia/3685846/0/muere-la-alto-cargo-coreana-que-sufrio-un-robo-con-violencia-en-barcelona/?utm_source=twitter.com&amp;utm_medium=socialshare&amp;utm_campaign=mobile_web""><span class=""tco-ellipsis""></span><span class=""invisible"">https://www.</span><span class=""js-display-url"">20minutos.es/noticia/368584</span><span class=""invisible"">6/0/muere-la-alto-cargo-coreana-que-sufrio-un-robo-con-violencia-en-barcelona/?utm_source=twitter.com&amp;utm_medium=socialshare&amp;utm_campaign=mobile_web</span><span class=""tco-ellipsis""><span class=""invisible""> </span>…</span></a> a través de <a class=""twitter-atreply pretty-link js-nav"" data-mentioned-user-id=""31090827"" dir=""ltr"" href=""/20m""><s>@</s><b>20m</b></a></p>",['https://www.20minutos.es/noticia/3685846/0/muere-la-alto-cargo-coreana-que-sufrio-un-robo-con-violencia-en-barcelona/?utm_source=twitter.com&utm_medium=socialshare&utm_campaign=mobile_web'],[],False,[],,1,0,0,False,False,,[]
438,TR16042615,T R,862330860250509312,1144337580911206402,/TR16042615/status/1144337580911206402,2019-06-27 20:11:54,1561666314,"@AdaColau 
No ha mort, l'han mort!
No ha fallecido de muerte natural, l'han mort la delinqüència que campa al seu aire a Barcelona, sense cap control. Ya va siendo hora de meter mano, pero MANO DURA al desmadre de delincuencia que hay en Barcelona!","<p class=""TweetTextSize js-tweet-text tweet-text"" data-aria-label-part=""0"" lang=""es""><a class=""twitter-atreply pretty-link js-nav"" data-mentioned-user-id=""102095809"" dir=""ltr"" href=""/AdaColau""><s>@</s><b>AdaColau</b></a> 
No ha mort, l'han mort!
No ha fallecido de muerte natural, l'han mort la <strong>delinqüència</strong> que campa al seu aire a <strong>Barcelona</strong>, sense cap control. Ya va siendo hora de meter mano, pero MANO DURA al desmadre de <strong>delincuencia</strong> que hay en <strong>Barcelona</strong>!</p>",[],[],False,[],,5,0,1,True,True,1144330623714254848,"[{'screen_name': 'CensuratNews', 'user_id': '835125421817593859'}, {'screen_name': 'embcoreaespana', 'user_id': '193621417'}]"
439,lluismp09,Lluís Manel,39623075,1144337472589041664,/lluismp09/status/1144337472589041664,2019-06-27 20:11:28,1561666288,"Se ha muerto la alto cargo de Corea del Sur que fue atracada en Barcelona. 

Aló @AdaColau son 4 años de inseguridad subiendo.","<p class=""TweetTextSize js-tweet-text tweet-text"" data-aria-label-part=""0"" lang=""es"">Se ha muerto la alto cargo de Corea del Sur que fue atracada en <strong>Barcelona</strong>. 

Aló <a class=""twitter-atreply pretty-link js-nav"" data-mentioned-user-id=""102095809"" dir=""ltr"" href=""/AdaColau""><s>@</s><b>AdaColau</b></a> son 4 años de <strong>inseguridad</strong> subiendo.</p>",[],[],False,[],,0,0,0,False,False,,[]
440,Perxens1,Pèrxens,1092857606396407814,1144332709440958464,/Perxens1/status/1144332709440958464,2019-06-27 19:52:33,1561665153,Tothom sap que a Corea parlen castellà i que a zones de Barcelona no hi ha inseguretat.,"<p class=""TweetTextSize js-tweet-text tweet-text"" data-aria-label-part=""0"" lang=""ca"">Tothom sap que a Corea parlen castellà i que a zones de <strong>Barcelona</strong> no hi ha <strong>inseguretat</strong>.</p>",[],[],False,[],,2,0,1,True,True,1144316407443861506,"[{'screen_name': 'AdaColau', 'user_id': '102095809'}, {'screen_name': 'bcn_ajuntament', 'user_id': '423369901'}]"
441,KarlosOwn,karlos_own®,342878706,1144330398039793667,/KarlosOwn/status/1144330398039793667,2019-06-27 19:43:22,1561664602,Yo confiaba en ti ... desde hace pocos años atrás barcelona se ha convertido en un nido de delincuencia e inseguridad. Por qué permites que los de casa vayamos con miedo? Triste y defraudado,"<p class=""TweetTextSize js-tweet-text tweet-text"" data-aria-label-part=""0"" lang=""es"">Yo confiaba en ti ... desde hace pocos años atrás <strong>barcelona</strong> se ha convertido en un nido de <strong>delincuencia</strong> e <strong>inseguridad</strong>. Por qué permites que los de casa vayamos con miedo? Triste y defraudado</p>",[],[],False,[],,9,1,1,True,True,1144316407443861506,"[{'screen_name': 'AdaColau', 'user_id': '102095809'}, {'screen_name': 'bcn_ajuntament', 'user_id': '423369901'}]"
442,lore9876,m.castell,198169447,1144330286295109633,/lore9876/status/1144330286295109633,2019-06-27 19:42:55,1561664575,La inseguridad aumenta en Barcelona: muere la alto cargo de Corea del Sur que sufrió un robo violento https://diariopatriota.com/la-inseguridad-aumenta-en-barcelona-muere-la-alto-cargo-de-corea-del-sur-que-sufrio-un-robo-violento/ …,"<p class=""TweetTextSize js-tweet-text tweet-text"" data-aria-label-part=""0"" lang=""es"">La <strong>inseguridad</strong> aumenta en <strong>Barcelona</strong>: muere la alto cargo de Corea del Sur que sufrió un robo violento <a class=""twitter-timeline-link u-hidden"" data-expanded-url=""https://diariopatriota.com/la-inseguridad-aumenta-en-barcelona-muere-la-alto-cargo-de-corea-del-sur-que-sufrio-un-robo-violento/"" dir=""ltr"" href=""https://t.co/FGBdJ32kR1"" rel=""nofollow noopener"" target=""_blank"" title=""https://diariopatriota.com/la-inseguridad-aumenta-en-barcelona-muere-la-alto-cargo-de-corea-del-sur-que-sufrio-un-robo-violento/""><span class=""tco-ellipsis""></span><span class=""invisible"">https://</span><span class=""js-display-url"">diariopatriota.com/la-inseguridad</span><span class=""invisible"">-aumenta-en-barcelona-muere-la-alto-cargo-de-corea-del-sur-que-sufrio-un-robo-violento/</span><span class=""tco-ellipsis""><span class=""invisible""> </span>…</span></a></p>",['https://diariopatriota.com/la-inseguridad-aumenta-en-barcelona-muere-la-alto-cargo-de-corea-del-sur-que-sufrio-un-robo-violento/'],[],False,[],,0,0,0,False,False,,[]
443,AmiroAlfredo,Alfred,622566511,1144327311191367680,/AmiroAlfredo/status/1144327311191367680,2019-06-27 19:31:06,1561663866,La inseguridad en barcelona es la misma que en cualquier gran ciudad hay turismo y eso atrae delincuentes,"<p class=""TweetTextSize js-tweet-text tweet-text"" data-aria-label-part=""0"" lang=""es"">La <strong>inseguridad</strong> en <strong>barcelona</strong> es la misma que en cualquier gran ciudad hay turismo y eso atrae delincuentes</p>",[],[],False,[],,0,0,0,False,True,1144277709939499013,"[{'screen_name': 'elmundoes', 'user_id': '14436030'}]"
444,jordicampag,Jordi Campa🔻,1097822222650085376,1144326457004625920,/jordicampag/status/1144326457004625920,2019-06-27 19:27:42,1561663662,"""Barcelona es una selva de delincuencia"" tweet i respostes farien riure si no fos tant perillós el que pot venir darrere de tot això. https://twitter.com/TitoEliteTx/status/1144312767236718594 …","<p class=""TweetTextSize js-tweet-text tweet-text"" data-aria-label-part=""4"" lang=""ca"">""<strong>Barcelona</strong> es una selva de <strong>delincuencia</strong>"" tweet i respostes farien riure si no fos tant perillós el que pot venir darrere de tot això. <a class=""twitter-timeline-link u-hidden"" data-expanded-url=""https://twitter.com/TitoEliteTx/status/1144312767236718594"" dir=""ltr"" href=""https://t.co/c2LNixHW6T"" rel=""nofollow noopener"" target=""_blank"" title=""https://twitter.com/TitoEliteTx/status/1144312767236718594""><span class=""tco-ellipsis""></span><span class=""invisible"">https://</span><span class=""js-display-url"">twitter.com/TitoEliteTx/st</span><span class=""invisible"">atus/1144312767236718594</span><span class=""tco-ellipsis""><span class=""invisible""> </span>…</span></a></p>",['https://twitter.com/TitoEliteTx/status/1144312767236718594'],[],False,[],,0,0,0,False,False,,[]
445,ScTaj,SCS,2550339132,1144324777244536834,/ScTaj/status/1144324777244536834,2019-06-27 19:21:02,1561663262,"En el barrio de Diagonal Mar y en todos los barrios cercanos, cada vez que hay una redada en el Raval la delincuencia se desplaza y aquí no hay ni rastro de @mossos ni @barcelona_GUB no son zonas tan mediáticas","<p class=""TweetTextSize js-tweet-text tweet-text"" data-aria-label-part=""0"" lang=""es"">En el barrio de Diagonal Mar y en todos los barrios cercanos, cada vez que hay una redada en el Raval la <strong>delincuencia</strong> se desplaza y aquí no hay ni rastro de <a class=""twitter-atreply pretty-link js-nav"" data-mentioned-user-id=""110946158"" dir=""ltr"" href=""/mossos""><s>@</s><b>mossos</b></a> ni <a class=""twitter-atreply pretty-link js-nav"" data-mentioned-user-id=""442728468"" dir=""ltr"" href=""/barcelona_GUB""><s>@</s><b><strong>barcelona</strong>_GUB</b></a> no son zonas tan mediáticas</p>",[],[],False,[],,1,0,0,False,True,1144314567138430978,"[{'screen_name': 'iBarbarellah', 'user_id': '455697160'}]"
446,PGVillaluenga,P. G. Villaluenga,1079446720562499586,1144323778698235904,/PGVillaluenga/status/1144323778698235904,2019-06-27 19:17:04,1561663024," En #Barcelona #BCN y en #Cataluña #Catalunya, también hay robos, atracos y mucha violencia, como en otras ciudades, pero Sra. @AdaColau y @QuimTorraiPla NO LO OCULTAMOS

#España #155Ya
#RepublicaCatalana #CUP #Generalidad #Generalitat
@elperiodico @tv3cat @EFEnoticias @rtve","<p class=""TweetTextSize js-tweet-text tweet-text"" data-aria-label-part=""0"" lang=""es""><img alt=""📣"" aria-label=""Emoji: Megáfono de animación"" class=""Emoji Emoji--forText"" draggable=""false"" src=""https://abs.twimg.com/emoji/v2/72x72/1f4e3.png"" title=""Megáfono de animación""/> En <a class=""twitter-hashtag pretty-link js-nav"" data-query-source=""hashtag_click"" dir=""ltr"" href=""/hashtag/Barcelona?src=hash""><s>#</s><b><strong>Barcelona</strong></b></a> <a class=""twitter-hashtag pretty-link js-nav"" data-query-source=""hashtag_click"" dir=""ltr"" href=""/hashtag/BCN?src=hash""><s>#</s><b>BCN</b></a> y en <a class=""twitter-hashtag pretty-link js-nav"" data-query-source=""hashtag_click"" dir=""ltr"" href=""/hashtag/Catalu%C3%B1a?src=hash""><s>#</s><b>Cataluña</b></a> <a class=""twitter-hashtag pretty-link js-nav"" data-query-source=""hashtag_click"" dir=""ltr"" href=""/hashtag/Catalunya?src=hash""><s>#</s><b>Catalunya</b></a>, también hay robos, atracos y mucha <strong>violencia</strong>, como en otras ciudades, pero Sra. <a class=""twitter-atreply pretty-link js-nav"" data-mentioned-user-id=""102095809"" dir=""ltr"" href=""/AdaColau""><s>@</s><b>AdaColau</b></a> y <a class=""twitter-atreply pretty-link js-nav"" data-mentioned-user-id=""4703390322"" dir=""ltr"" href=""/QuimTorraiPla""><s>@</s><b>QuimTorraiPla</b></a> NO LO OCULTAMOS

<a class=""twitter-hashtag pretty-link js-nav"" data-query-source=""hashtag_click"" dir=""ltr"" href=""/hashtag/Espa%C3%B1a?src=hash""><s>#</s><b>España</b></a><img alt=""🇪🇸"" aria-label=""Emoji: Bandera de España"" class=""Emoji Emoji--forText"" draggable=""false"" src=""https://abs.twimg.com/emoji/v2/72x72/1f1ea-1f1f8.png"" title=""Bandera de España""/> <a class=""twitter-hashtag pretty-link js-nav"" data-query-source=""hashtag_click"" dir=""ltr"" href=""/hashtag/155Ya?src=hash""><s>#</s><b>155Ya</b></a>
<a class=""twitter-hashtag pretty-link js-nav"" data-query-source=""hashtag_click"" dir=""ltr"" href=""/hashtag/RepublicaCatalana?src=hash""><s>#</s><b>RepublicaCatalana</b></a> <a class=""twitter-hashtag pretty-link js-nav"" data-query-source=""hashtag_click"" dir=""ltr"" href=""/hashtag/CUP?src=hash""><s>#</s><b>CUP</b></a> <a class=""twitter-hashtag pretty-link js-nav"" data-query-source=""hashtag_click"" dir=""ltr"" href=""/hashtag/Generalidad?src=hash""><s>#</s><b>Generalidad</b></a> <a class=""twitter-hashtag pretty-link js-nav"" data-query-source=""hashtag_click"" dir=""ltr"" href=""/hashtag/Generalitat?src=hash""><s>#</s><b>Generalitat</b></a>
<a class=""twitter-atreply pretty-link js-nav"" data-mentioned-user-id=""198829810"" dir=""ltr"" href=""/elperiodico""><s>@</s><b>elperiodico</b></a> <a class=""twitter-atreply pretty-link js-nav"" data-mentioned-user-id=""28373820"" dir=""ltr"" href=""/tv3cat""><s>@</s><b>tv3cat</b></a> <a class=""twitter-atreply pretty-link js-nav"" data-mentioned-user-id=""105082141"" dir=""ltr"" href=""/EFEnoticias""><s>@</s><b>EFEnoticias</b></a> <a class=""twitter-atreply pretty-link js-nav"" data-mentioned-user-id=""26729931"" dir=""ltr"" href=""/rtve""><s>@</s><b>rtve</b></a></p>",[],"['Barcelona', 'BCN', 'Cataluña', 'Catalunya', 'España', '155Ya', 'RepublicaCatalana', 'CUP', 'Generalidad', 'Generalitat']",False,[],,1,0,1,True,True,1144273140954083328,"[{'screen_name': 'cronicaglobal', 'user_id': '81081065'}]"
447,LastJourno,𝐓𝐡𝐞 𝐋𝐚𝐬𝐭 𝐉𝐨𝐮𝐫𝐧𝐨,701328739418906624,1144322978110431233,/LastJourno/status/1144322978110431233,2019-06-27 19:13:53,1561662833,A ver mañana quién pone la correspondiente placa en la calle “víctima de la laxitud institucional contra la delincuencia del Ayuntamiento de Barcelona”. https://twitter.com/cronicaglobal/status/1144273140954083328 …,"<p class=""TweetTextSize js-tweet-text tweet-text"" data-aria-label-part=""4"" lang=""es"">A ver mañana quién pone la correspondiente placa en la calle “víctima de la laxitud institucional contra la <strong>delincuencia</strong> del Ayuntamiento de <strong>Barcelona</strong>”. <a class=""twitter-timeline-link u-hidden"" data-expanded-url=""https://twitter.com/cronicaglobal/status/1144273140954083328"" dir=""ltr"" href=""https://t.co/1WyCGaPipj"" rel=""nofollow noopener"" target=""_blank"" title=""https://twitter.com/cronicaglobal/status/1144273140954083328""><span class=""tco-ellipsis""></span><span class=""invisible"">https://</span><span class=""js-display-url"">twitter.com/cronicaglobal/</span><span class=""invisible"">status/1144273140954083328</span><span class=""tco-ellipsis""><span class=""invisible""> </span>…</span></a></p>",['https://twitter.com/cronicaglobal/status/1144273140954083328'],[],False,[],,3,2,0,False,False,,[]
